Le prétendant légitimiste au trône , le Comte de Chambord , 32 ans et sans enfant pourrait avoir pour successeur le prétendant orléaniste , le Comte de Paris ( 14 ans ) .	orléaniste	22	Masc
Ses vieux quartiers s' accrochent au versant sud de la colline du Castéou et dominent la ville moderne et la rade qu' enserrent le cap Bénat et la presqu'île de Giens .	vieux	1	Masc
Il est moins un penseur original qu' un codificateur de la pratique architecturale de son époque .	architecturale	12	Fem
En 1963 , la Cour suprême reconnaît un droit à l' aide juridictionnelle dans les affaires criminelles , en s' appuyant sur le Sixième Amendement de la Constitution ( Gideon v. Wainwright ) .	Sixième	23	Masc
Selon les spécialistes norvégiens de la MINURCAT , ce forage est unique dans cette zone à la fois par son rendement et sa profondeur .	norvégiens	3	Masc
Il participa aux combats qui permirent de s' emparer le 26 novembre ( julien ) du mont Driskos , près de Ioannina .	julien	13	Fem
Le Français défendra les couleurs de l' Olympique Lyonnais , tandis que l' autre pilote tricolore de ce championnat , Franck Montagny , roulera pour le compte des Girondins de Bordeaux .	tricolore	15	Masc
Fleurs solitaires et terminales , campanulées et pendantes , avec 4-6 sépales bleu violacé , lancéolés ( long : 25-50 mm ) , à l' ovaire pubescent .	pendantes	7	Fem
Puis en 1946 suit la réforme sur l' organisation communale , la ville est administrée par un maire , une junte et un conseil .	communale	9	Fem
L' officiant fait se relever le nouveau frère et l' embrasse sur la bouche qui est le baiser d' hommage féodal .	féodal	20	Masc
Il termine l' année sur de meilleures impressions avec une 5e place à Kranjska Gora et une 7e à Lenzerheide pour terminer à la 12e place du classement du slalom .	12e	24	Fem
Seules des impostes moulurées , ayant servi d' appui pour les cintres , viennent animer la nudité des murs , lesquels ne comportent aucune lésène ni bandeau .	moulurées	3	Fem
En 1901 , le chemin de fer alsacien a reçu un nouveau tracé de la voie vers la sortie de la ville .	alsacien	7	Masc
La tâche ne sera pas aisée .	aisée	5	Fem
Et lors de la Coupe du monde de football adapté , en août dernier , la France a été éliminée en quarts de finale .	adapté	9	Masc
Les sandwichs libanais sont l' un des éléments de la cuisine libanaise les plus populaires à travers le monde .	libanaise	11	Fem
Est -elle linéaire ou cyclique ?	cyclique	4	Fem
Le thérapeute doit rechercher les informations pour comprendre son client et cela a déjà une action thérapeutique puisque cela nécessite pour ce dernier de questionner ses liens mentaux , ses associations , généralisations , omissions , objectifs .	thérapeutique	16	Fem
Vers la fin de sa vie Upfield devint un membre éminent de la société géologique australienne , et participa à plusieurs expéditions scientifiques .	éminent	10	Masc
La soldatesque fut moins tolérante et moins humaine : elle déchira son cadavre , livra ses lambeaux aux flammes et jeta les cendres aux vents .	humaine	7	Fem
L' éternité est un état censé être indépendant du temps et n' avoir donc ni début , ni fin .	indépendant	7	Masc
Le téléphone est erroné : il faut composer le 02_31_30_47_70	erroné	3	Masc
Le bar à vin le plus sympas de Florence !	sympas	6	Masc
De même , cette position peut aussi dans une certaine mesure presenter des analogie avec la refutation de l' existence de tout fondement strictement rationnel à la définition de la justice opérée par Cornelius Castoriadis .	rationnel	24	Masc
La Mort de Yazdgerd ) est une pièce de théâtre télévisée du metteur en scène et scénariste iranien Bahram Beyzai .	télévisée	10	Fem
Comment réagira l' armée égyptienne qui subit actuellement de fortes pressions internes et externes visant à lui faire jouer un rôle contre-révolutionnaire ?	égyptienne	4	Fem
La distinction entre les intensité électriques autorisées ( telles que 16 A , 32 A , 63 A et 125 A ) se fait grâce au diamètre des connecteurs circulaires .	circulaires	29	Masc
La division cuirassée ( ou DCr pour division cuirassée ) est une unité blindée éphémère de l' armée française , créée le 20 mars 1940 à Chatou , qui combattit durant la Seconde Guerre mondiale .	cuirassée	2	Fem
Passé professionnel en 1962 , il remporte le titre vacant de champion du monde des poids super-plumes WBC le 15 février 1969 après sa victoire aux points contre Ruben Navarro .	vacant	9	Masc
Bayard présente la particularité d' avoir une échine qui s' allonge pour porter les quatre frères Aymon , tout comme la blanque jument .	blanque	21	Fem
Maintenant , c' est à la télévision que les enfants peuvent retrouver chaque semaine Fafouin et sa joyeuse bande .	joyeuse	17	Fem
Quant aux libertés individuelles , elle ne sont pas acceptables et doivent être guidées par la tyrannie rationnelle .	rationnelle	17	Fem
La conférence est sortie avec une conclusion clef , à savoir que le Conseil national de transition libyen est responsable des armes en circulation .	libyen	17	Masc
Très peu de journalistes mexicains ont pu échapper vivants à leurs ravisseurs .	mexicains	4	Masc
Baxán est une localité de la parroquia de Santiago de Barbadelo dans le municipio de Sarria , comarque de Sarria , province de Lugo , communauté autonome de Galice , au nord-ouest de l' Espagne .	autonome	26	Fem
Sa collection d' histoires courtes , ( tel que Le Chant des Sirènes ) explore l' impact douloureux de la diaspora haïtienne à la fois sur les individus en exil et la communauté haïtienne .	haïtienne	33	Fem
Cependant , Evolution ne reçut pas non plus de bonnes critiques de la part des critiques musicales .	musicales	16	Fem
Abram Room compose son film selon l' opposition entre les espaces infinis du ciel et la cellule du condamné , entre l' espace individuel restreint et l' espace collectif tellement vaste qu' il n' est pas utilisé .	infinis	11	Masc
Les glucocorticoïdes participent aussi à la potentialisation de ce signal noradrénergique amygdalien .	amygdalien	11	Masc
Les explorateurs non-autochtones n' y pénétrèrent pas avant les années 1820 , et c' est seulement à partir de la découverte d' or dans la ville actuelle d' Yreka en 1851 que le premier établissement euro-américain eut lieu .	euro-américain	35	Masc
Cependant , cela conduira les forces de défense au bord de l' annihilation , ce qui entraînera son licenciement pur et simple .	pur	19	Masc
Catégorie : Affaire politico-financière française	française	4	Fem
Un relooking extrême pour Sarvenaz : moderne , rock et sexy .	sexy	10	Fem
Joe Millar prend en charge l' ensemble du secteur sportif .	sportif	9	Masc
Mais aucune donnée actuelle ne permet de prouver ni même d' expliquer comment des phénomènes cognitifs aussi complexes que des connaissances ou des représentations spécifiques à la copulation peuvent être codés dans les cortex associatifs .	associatifs	34	Masc
Dans ce contexte , elles ont réaffirmé leur soutien aux efforts en cours de l' UA pour instaurer une paix durable au Darfour et en Somalie .	durable	20	Fem
Son déroulement est assez semblable le dimanche octave et le dimanche de pentecôte .	semblable	4	Masc
Durant la Première Guerre mondiale , il sert dans la flotte de la Méditerranée afin d' assurer l' approvisionnement et de protéger les troupes françaises de la marine austro-hongroise .	austro-hongroise	28	Fem
Le gouvernement est désormais dominé par les « moyenneurs » , des humanistes qui croîent possible la réconciliation des chrétiens , moyennant des concessions réciproques .	réciproques	24	Fem
Si la mode en tant que telle ne fait pas vraiment partie des valeurs patrimoniales maliennes , de plus en plus de jeunes créateurs parviennent à exprimer leur talent .	patrimoniales	14	Fem
Le Conirostre roux ( Conirostrum rufum ) , aussi appelé Sucrier à sourcils roux , est une espèce de passereaux de la famille des Thraupidae .	roux	2	Masc
Son ventre est blanchâtre avec , parfois , des taches brunes au niveau de la gorge .	brunes	10	Fem
Il a participé pendant la première guerre mondiale à la campagne du Maroc , enrôlé quatre ans dans l' armée française .	française	20	Fem
Les origines de la cité remontent à l' époque précolombienne .	précolombienne	9	Fem
Il est dédié à la déesse Yan Po Nagar , fondatrice légendaire du Champa , plus tard identifiée aux déesses hindoues Bhagavati et Mahishasuramardini , et qui est appelée en vietnamien Thiên Y Thánh Mâu .	hindoues	20	Fem
L' essence est indifférente à l' existence .	indifférente	3	Fem
En traversant la vanne , l' hélium liquide se refroidit et se vaporise partiellement .	liquide	7	Masc
Child Focus a mis 300 enfants à l' honneur dans le cadre de Journée Internationale des Enfants Disparus ce mercredi .	Disparus	17	Masc
Dusted est un guide non-officiel comprenant des commentaires sur tous les épisodes de Buffy contre les vampires ainsi que sur les comics et romans antérieurs à 2003 .	non-officiel	4	Masc
La technique du tore magnétique utilisait la capacité d' un tore de ferrite à conserver une information magnétique binaire .	magnétique	4	Masc
- De 2004 à 2006 s' est développée une extension inattendue de cette affaire .	inattendue	10	Fem
Comme la plupart des régimes similaires , le régime du 4 août adopta un programme fortement nationaliste .	nationaliste	16	Masc
L' île possède une forêt rabougrie d' épinette , de pin et de chêne .	rabougrie	5	Fem
Toutes les chaînes , analogiques comme numériques , seront interrompues au cours de la nuit du 26 janvier au 27 janvier de 00h45 à 5h45 .	numériques	6	Fem
En plus , on y répare les bijoux sur place : le service et la qualité sont impeccables et à tous petits prix , comparés aux devis exorbitants des autres boutiques !	impeccables	17	Masc
Les premières compétences obligatoires de ce Sivom sont l' assainissement des eaux usées , la collecte des ordures et l' organisation d' achats groupés de matériel .	obligatoires	3	Fem
J' appuie aussi le désir de quitter un format suranné et de réunir les partenaires dans la recherche de moyens innovateurs pour endiguer le chômage .	suranné	9	Masc
Elle débute au 25-31 rue de la Tour et se termine au 8 bis rue Eugène-Manuel .	bis	13	Masc
La résolution d' un microscope confocal peut être déterminée expérimentalement ou théoriquement à l' aide de la fonction d' étalement du point ( Point Spread Function ou PSF en anglais ) .	confocal	5	Masc
Un premier bilan sera réalisé en 2012 , avant éventuellement d' étendre cette mesure à d' autres sites touristiques .	touristiques	18	Masc
Chaque cabine était équipée d' un lit double en osier , d' un lavabo escamotable avec eau chaude et froide et un bouton d' appel du personnel .	escamotable	14	Masc
Une diminution du taux circulant des hormones sexuelles , principalement des estrogènes convertis à partir des androgènes , joue aussi un rôle dans la perte osseuse graduelle observée chez les hommes .	osseuse	25	Fem
L' arrivée des troupes italiennes en juin 1940 inquiète le prince Louis II à titre personnel .	italiennes	4	Fem
Le résultat est incroyable : album magnifique et vidéo émouvante ... bref tout le monde en parle !	émouvante	9	Fem
Petite station de ski des Pyrénées de la haute vallée de l' Aude : voir Puyvalador ( station ) .	Petite	0	Fem
Une comédie romantique , ou comédie sentimentale , est un film mettant en scène de manière humoristique l' histoire d' amour ( ou du moins , une partie de l' histoire d' amour ) entre deux personnes .	humoristique	16	Fem
Les réserves mobiles que les Allemands possédaient consistaient en environ 150 véhicules blindés de combat , sous le commandement de la 1re armée parachutiste , la majorité d' entre eux appartenant au XLVII .	parachutiste	23	Fem
En France la clématite ' ville de Lyon ' est distribuée par plusieurs pépinières dont les pépinières TRAVERS , spécialiste des plantes grimpantes .	grimpantes	22	Fem
Mais aucune donnée actuelle ne permet de prouver ni même d' expliquer comment des phénomènes cognitifs aussi complexes que des connaissances ou des représentations spécifiques à la copulation peuvent être codés dans les cortex associatifs .	complexes	17	Masc
En tout , sept empreintes digitales non identifiées sont retrouvées sur les lieux .	digitales	5	Fem
« J' ai commis une faute bête » , a reconnu le Bernois .	bête	6	Fem
Si l' on en croit Gerry L' Étang , il est question de Nagoumila en Martinique , de Nagoumira en Guadeloupe et de Nagura au Suriname et au Guyana , toutes ces formes dérivant de l' appellation originelle .	originelle	37	Fem
TF1 est une chaîne privée , dont l' honnête PDG expliquait : « pour qu' un message publicitaire soit perçu , il faut que le cerveau du téléspectateur soit disponible .	publicitaire	17	Masc
Au XIVe siècle , l' église était une simple nef rectangulaire qui dépendait de l' abbaye de la Couture au Mans .	rectangulaire	10	Fem
Vérine ( Aelia Verina ) ( morte en 484 ) est l' épouse de l' empereur byzantin Léon I et la belle-mère de son successeur Zénon .	byzantin	16	Masc
- Si vous êtes enceinte ou pensez l' être	enceinte	4	Fem
À Châteaurenard , c' est dans le quartier du Vigneret que l' on trouve le plus de vestiges romains .	romains	18	Masc
Quelque 6,7 millions de Nigériens sont appelés aux urnes dans ce pays sahélien , important producteur d' uranium mais pourtant classé parmi les plus pauvres du monde .	pauvres	24	Masc
L' ambiance du jeu est un mélange entre les univers gothique et fantasy fortement teintée d' action pure .	fantasy	12	Masc
Silvestro Chiesa ( né à une date inconnue à Gênes en Ligurie et mort en 1657 dans cette même ville ) est un peintre italien baroque de l' école génoise au XVIIe siècle .	baroque	25	Masc
Le parti des classes ouvrières aurait dû reconnaître à temps les signes de la guerre qui s' annonçait et les faire connaître .	ouvrières	4	Fem
Il va en guerre dans la First Australian Imperial Force durant la Première Guerre mondiale .	First	6	Fem
Née et élevée dans une famille baptiste , elle tient à garder une image irréprochable .	irréprochable	14	Fem
Une précédente église de romane était édifiée sur le site actuel .	précédente	1	Fem
En ce sens , les prévenus ont été condamnés solidairement à payer environ 17_600 euros de dommages-intérêts aux parties civiles pour les seuls meubles entreposés dans les immeubles qui , juridiquement , ne leur appartenaient pas .	civiles	19	Fem
Ceci , ajouté aux déficiences des réseaux d' infrastructures et de services et à une offre d' emploi généralement très limitée et tout au plus saisonnière et peu diversifiée , accentuent l' exode rural .	saisonnière	25	Fem
Il est démontré que l' amaigrissement des patients arthrosiques en surpoids retarde l' évolution de la maladie .	arthrosiques	8	Masc
Le Dieu utilise sa puissance pour retourner le cours de la bataille , extermine l' armée barbare , sauve Kratos , et fait de lui son serviteur .	barbare	16	Fem
L' Académie Équestre Pannon , appartenant à l' Université de Kaposvár , est chargée de la formation des spécialistes dans le domaine de l' organisation d' événements équestres .	équestres	27	Masc
En séducteur honnête , le compositeur dédia cet opéra au « Beau Sexe de Milan » .	honnête	2	Masc
Quels sont les effets indésirables éventuels 5 .	éventuels	5	Masc
La coupe de la ligue islandaise de football 2010 ( Lengjubikarinn 2010 ) est la 15éme édition de cette compétition d' avant-saison islandaise .	islandaise	5	Fem
Interrogé par le Parlement , le gouvernement indien a affirmé que les taux de fer et de fluoride dans les eaux souterraines du pays étaient anormalement élevés dans respectivement 254 et 224 districts .	souterraines	21	Fem
En 1583 , la nomination de John Whitgift comme archevêque de Canterbury a signalé le départ d' un mouvement contre la tendance presbytérienne dans l' Église , et une ère de censure commença .	presbytérienne	22	Fem
La piscine chauffée au pied des gîtes est très appréciable également ( surtout le soir au retour des ballades ) .	appréciable	9	Fem
Un synode diocésain se tient en 1335 à l' initiative de l' évêque d' Orléans Jean III ou Jean IV .	diocésain	2	Masc
Il y passe les 20 années suivantes en pratiques spirituelles -- incluant de longues heures de méditation , la pratique de l' athlétisme , l' écriture de poésies , essais et chants spirituels .	spirituels	32	Masc
Un terrible péril menace le glorieux empire d' Égypte .	glorieux	5	Masc
Les modèles destiné au grand public disposent de modes intelligents performants , adaptés aux personnes souhaitant un appareil simple sans se soucier de la technique -- ouverture , temps de pose , sensibilité .	performants	10	Masc
Leur conception se limite à une vision dualiste et dogmatique de la vie où tout est catégorisé en termes de pur et d' impur .	dogmatique	9	Fem
Il devient membre de la Société linnéenne de Londres et de la Leopoldina de Halle .	linnéenne	6	Fem
Des personnes non-identifiées auraient aussi tenté de mettre le feu à un monastère .	non-identifiées	2	Fem
Deux espèces ( Eurylaime vert et de Hose ) sont considérées comme quasi-menacée ( NT ) et une ( Eurylaime de Whitehead ) comprise dans la catégorie préoccupation mineure ( LC ) .	mineure	28	Fem
Les charges sont les suivantes : trahison , sédition , écrits incendiaires , et menées hostiles dans le but d' expulser les autorités espagnoles .	hostiles	15	Fem
Il recruta de grands spécialistes en microbiologie , et l' un deux fit de brillantes avancées .	brillantes	14	Fem
Ce dernier a pris ses fonctions ce lundi 19 décembre , sous l' autorité de Pierre-Henry Médan , directeur général de la régie publicitaire chargée de la commercialisation de RMC , BFM Business ou encore BFM TV .	publicitaire	23	Fem
Son achèvement est retardé principalement en raison de l' inclusion de radars et d' armements anti-aériens .	anti-aériens	15	Masc
Ainsi , la force et la direction du champ magnétique de l' étoile peut être déterminées par l' observation des lignes avec l' effet Zeeman .	magnétique	9	Masc
Le film surprend par la justesse de son observation , son style novateur et son anticonformisme , parfaitement représentatifs de la génération des « Jeunes gens en colère » dont le Free cinema est proche .	représentatifs	18	Masc
Stottlemeyer est conscient du fait qu' il n' a pas les capacités de déduction de Monk .	conscient	2	Masc
L' expérience a démontré les limites des pratiques bureaucratiques et sécuritaires dans la gestion publique .	sécuritaires	10	Fem
La Fiat Tipo est le modèle compact de voiture fabriqué par Fiat de 1988 à 1995 .	compact	6	Masc
Comment expliquer l' encerclement du local d' une organisation politique légale ?	légale	10	Fem
Afin de limiter les risques d' accident du cheval et de son cavalier , certains équipements sont obligatoires tandis que d' autres sont conseillés .	obligatoires	17	Masc
Avec cette étude , le canton de Berne veut évaluer les conséquences sur sa minorité francophone de la création d' une entité formée du Jura et du Jura bernois .	bernois	28	Masc
La common law écossaise commence à prendre forme à la fin de cette période , en mêlant les lois celtes et gaéliques avec les pratiques de l' Angleterre anglo-normande et du continent .	anglo-normande	28	Fem
Le peuple seul est en mesure , par sa mobilisation et sa détermination , de renverser les régimes dictatoriaux et autoritaires .	autoritaires	20	Masc
Ils sont alimentés en eau douce par les rivières Avon , Thomson , Latrobe , Mitchell , Nicholson et Tambo .	douce	5	Fem
Emilio Larrosa Irigoyen , est un producteur de télévision mexicain .	mexicain	9	Masc
Si l' opportunité d' accéder à l' étage supérieur se présentait avant , il est bien évident que le club la saisirait mais ce n' est pas sa priorité immédiate .	immédiate	29	Fem
Le château de Gaujacq est une demeure seigneuriale du XVII siècle , bâtie par un lieutenant général des armées du roi Louis XIV .	seigneuriale	7	Fem
L' ancienne crypte du XIe siècle dédié à Saint Triphon est abandonnée au XIIIe siècle lors de la construction de la chapelle dans la partie supérieure du chateau .	XIIIe	13	Masc
Raf1-P est à l' origine d' une suite d' activations en cascade par phosphorylation d' une série de MAP-Kinases hyaloplasmiques ;	hyaloplasmiques	19	Masc
Baptisé le 8 juin 1922 en l' église Saint-François Xavier à Paris dans le 7e arrondissement , il a pour parrain , son oncle paternel : Xavier de Gaulle .	7e	14	Masc
Si vous cherchez un bon teppanyaki , abordable , sympathique et discret vous trouverez votre bonheur	abordable	7	Masc
L' enquête sur sa mort a été classée sans suite , étant considérée comme accidentelle .	accidentelle	14	Fem
Vivant à une époque où le mécénat était en voie de disparition , Young est remarquable pour sa recherche obstinée de soutien pour sa poésie , ses œuvres théâtrales , et sa carrière ecclésiastique .	théâtrales	28	Fem
Il n' est cependant pas rare de déléguer cette tâche à un chef de piste spécialisé des tours d' hippique .	spécialisé	15	Masc
Un message rapide pour vous témoigner de mon passage chez PGM Coignières le week-end dernier , où j' y ai eu un acceuil particlièrement attentif professionnel et sympathique !	attentif	24	Masc
J' appuie aussi le désir de quitter un format suranné et de réunir les partenaires dans la recherche de moyens innovateurs pour endiguer le chômage .	innovateurs	20	Masc
Proboscidea althaeifolia est une espèce végétale de la famille des Pedaliaceae selon la classification classique , ou des Martyniaceae selon la classification phylogénétique .	végétale	5	Fem
La Société ivoirienne d' oxygène et d' acétylène ( SIVOA ) , est une société anonyme au capital social de FCFA et dont le siège social est à Abidjan .	ivoirienne	2	Fem
Véritable projet multimédia , le concept demande beaucoup de moyens techniques et de flexibilité .	multimédia	2	Masc
Angiox est utilisé - Chez les patients souffrant de douleurs thoraciques dues à une affection cardiaque ( syndromes coronariens aigus SCA )	coronariens	18	Masc
Il obtiendra du Chef de l' Etat , en avril 1984 , un arbitrage qui préservera pour 20 ans l' essentiel de l' outil industriel lorrain .	lorrain	25	Masc
Chang'an remplace Luoyang et Jiankang comme le plus grand centre bouddhique de Chine .	bouddhique	10	Masc
Les produits sont bien mis en valeur et facilement accessible .	accessible	9	Masc
Data est un androïde , une forme avancée de vie artificielle , doté d' un cerveau positronique .	avancée	7	Fem
Les guitares bruitistes et les mélodies punks brutes typiques de leur premières années d' existence font place dans cet opus à un rock beaucoup plus propre , aux influences disco .	bruitistes	2	Fem
Le Handley Page Hermes est un avion de ligne quadrimoteur dérivant du Handley Page Hastings .	quadrimoteur	9	Masc
Des dizaines de chansons qui « raillent les impostures » , racontent des histoires sensibles , fraternelles , ironiques , qui vont à l' essentiel , ce que Philippe Corcuff appelle « l' utopie sceptique .	sensibles	14	Fem
Jeune espoir des années 80 , il a été le héros au cinéma de P'tit con , sorti en 1984 , et à la TV de Les Beaux quartiers d' après Louis Aragon .	Beaux	27	Masc
En 986 , il se marie avec , la fille de Géza , duc de Hongrie , qui sera la mère de son fils aîné Bezprym .	aîné	24	Masc
La question de l' égalité « justicielle » , si elle vient avant la réponse éthique , court-circuite la relation éthique .	justicielle	6	Fem
Le district est le plus grand district scolaire á États-Unis .	scolaire	7	Masc
« La Saumeto » appartient à l' ensemble des ex-voto de la galerie du Beausset Vieux , classés monuments historiques en 1995 .	Vieux	15	Masc
L' émetteur malveillant des requêtes ping peut même générer une nouvelle adresse IP aléatoire dans chaque nouvelle requête .	aléatoire	13	Fem
A terme , une action globale menée sur chaque bassin versant permettra l' amélioration de la capacité d' évacuation des cours d' eau .	versant	10	Masc
S' en suit un parcours standard de montagnes russes , contenant notamment une double inversion appelée roll-over , un corkscrew ( « tire-bouchon » ) , de nombreuses descentes , virages serrés et un arrêt brusque .	serrés	31	Masc
Le Préfet Jacques Géraut vient de publier le 31 mars 2010 un très long communiqué dans lequel il retrace froidement l' histoire " administrative " de ce cas particulier .	administrative	23	Fem
La compagnie dessert neuf destinations népalaises que voici :	népalaises	5	Fem
Constituant une plaine fertile à l' est comme à l' ouest du lac , enrichie par des dépôts marins argileux , cette vallée est entourée par le bouclier canadien .	marins	18	Masc
Après un bref séjour dans un hôpital psychiatrique , elle s' engage dans une série de batailles légales contre les personnes qui l' ont faite interner et les journaux qui ont clamé qu' elle était folle .	folle	35	Fem
Le mouvement régénérationniste réclame des réformes radicales pour sortir l' Espagne de son marasme .	radicales	6	Fem
C' est assez spectaculaire et , surtout , extrêmement utile si vous êtes dans un pays étranger dont vous ne parlez peu ou pas la langue .	spectaculaire	3	Masc
Durant les siècles de l' empire tardif , les traditions philosophiques néoplatonicienne et néopythagoricienne , apparues à Rome avec les cultures Hellénistique et Alexandrine , ont un poids déterminant et influencent fortement la pensée des théoriciens de ce temps .	tardif	6	Masc
