Le CNFE organise des activités d' échanges et d' accueil réciproques entre professionnels désireux de confronter les systèmes de protection de la jeunesse , les cadres de références et les pratiques respectives .	désireux	13	Masc
Il a des activités dans 14 états de l' Inde avec le support d' organisation américaines et britanniques .	britanniques	17	Fem
Le freinage , de type hydraulique à double circuit , est mixte , disques pleins à l' avant , tambours à l' arrière , assisté par un servofrein à dépression .	mixte	11	Masc
Les réalisateurs « autochtones » sont les mieux placés pour produire des films sur les Révolutions arabes .	autochtones	3	Masc
En cas de vol transméridien supérieur à environ cinq heures ( phénomène de décalage horaire ) on observe une désynchronisation chez les individus .	transméridien	4	Masc
Cette dernière entrée est en moyen anglais et non en vieil anglais .	vieil	10	Masc
Le Crédit Coopératif est régi , principalement , comme coopérative par la législation coopérative , et en tant que banque , par le Code monétaire et financier .	Coopératif	2	Masc
Le restaurant est excellent pour un budget ( en étape affaire en tout cas ) très abordable .	abordable	16	Masc
À l' époque des Ptolémées , elle se divisait en quartiers très différenciés , Éléphantine bénéficiant d' un caractère résidentiel et la rive orientale constituant une agglomération d' ouvriers et artisans .	orientale	23	Fem
L' efficacité de la police nationale y est facilement contestée , souvent par méconnaissance du travail quotidien accompli par les 3.000 policiers mobilisés sur la 2ème ville de France » , écrit M. Parant dans un communiqué .	quotidien	16	Masc
La pré-éclampsie ( appelée aussi toxémie gravidique ) est une hypertension artérielle gravidique ( HTA ) qui apparaît dans la deuxième moitié de la grossesse .	artérielle	11	Fem
Elle est réduite d' environ 20 % chez les patients atteints d' insuffisance rénale modérée ou sévère et de 80 % chez les patients dépendants de la dialyse ( Tableau 11 ) .	modérée	14	Fem
L' offre télévisuelle en matière de cinéma s' est étendue avec la création de deux chaînes privées : La cinq et M6 trois ans plus tôt .	télévisuelle	2	Fem
La femelle couve de 5 à 6 œufs , ovales et légèrement piriformes , gris verdâtre et tachés de brun-rouge , dont la taille a pour valeurs extrêmes : 16,4 -- × 12,5 -- .	verdâtre	15	Masc
Le reporter explore cet univers étrange et entreprend de libérer l' Atlantide des dieux sanguinaires qui la tyrannisent depuis des milliers d' années .	étrange	5	Masc
Le 5 avril ( 95 jour de l' année ou 96 en cas d' année bissextile ) en sport .	bissextile	15	Fem
Tout ceci nous conduit au désagréable sentiment que l' économie mondiale se dirige tout droit vers la déflation .	désagréable	5	Masc
Tout comme les années précédentes , nous avons passé de très bonnes vacances au calme dans cet hôtel situé dans un parc ombragé , à 50 mètres de la plage .	ombragé	22	Masc
À sa saison recrue , il cogne 26 coups de circuits et totalise 84 points produits .	recrue	3	Fem
L' accueil est très décevant , bien en dessous des prestations affichées par l' établissement .	décevant	4	Masc
Une petite race humanoïde ( 10 cm de haut ) qui vit dans les jardins et a une intense rivalité avec ses proches parents , les Fées .	intense	18	Fem
Et le soir , comme si les enfants n' en avaient jamais assez de l' eau , ils repartaient profiter de la piscine couverte .	couverte	23	Fem
Aujourd'hui c' est un musée situé au cœur du centre-ville et entouré de nombreux hôtels et attractions touristiques .	touristiques	17	Fem
La surface ventrale est crème pâle .	pâle	5	Fem
En 2009 , il gagne la première course à laquelle il participe en catégorie Super KF .	Super	14	Fem
Son angoisse s' assortit d' une diminution inquiétante de son érection , ce qui fait naître sa peur de ne plus pouvoir satisfaire Laura , sa jeune maîtresse .	inquiétante	7	Fem
L' économie est soutenue par la professionnalisation du 8e régiment d' artillerie , installé depuis 1963 dans la commune .	8e	8	Masc
C' est une agence sérieuse et ils proposent une solution qui évite les démarches et recherches laborieuses .	laborieuses	16	Fem
La race est classée mixte , mais la production laitière ( 4400 kg en 1995 ) ne fait pas le poids face aux races plus spécialisée .	mixte	4	Fem
« Nous ne l' approuvons pas car elle n' est pas conforme à la mission de la France de défense des droits de l' Homme dans le monde » , a -t -il affirmé .	conforme	11	Fem
Un locuteur vaudois , par exemple , aura très souvent tendance à prononcer le « e muet » des mots se terminant par -ée , -ie , -ue .	vaudois	2	Masc
Costumés en soldats de l' époque napoléonienne , Philippe Geluck , Malvira et plusieurs figurants y ont livré une bataille de tartes à la crème .	napoléonienne	6	Fem
Il est fusionné en 1886 avec le Brabançon et l' Ardennais belge pour former la race nationale du trait belge .	belge	11	Masc
L' économie s' est développée autour des activités publiques et militaires ( il y a deux bases importantes à proximité ) , du pétrole et du tourisme en période estivale .	estivale	29	Fem
Nombreux sont les personnels de surveillance qui y font un stage ou leurs premiers mois au service de l' État .	Nombreux	0	Masc
Le quartier Bayard de la ville française de Toulouse se situe géographiquement entre la gare de Toulouse-Matabiau et l' hyper-centre urbain .	urbain	20	Masc
Les générations suivantes se souviennent de la bataille telle qu' elle est décrite par William Shakespeare dans le dernier volet de sa trilogie dramatique Henri VI .	dramatique	23	Fem
Le nom Aurland vient du vieux norrois aurr qui signifie gravier , et land qui signifie endroit ou territoire .	vieux	5	Masc
Tour à tour abrité dans cette chapelle , celle des Mariniers puis des Pénitents Blancs , le culte paroissial devait finir par s' installer dans une salle du couvent des Franciscains de Picpus .	paroissial	18	Masc
Une cérémonie de prise de possession a lieu appliquant la Charte Royale durant laquelle il fait planter des fourches patibulaires pour marquer cette prise de droit .	patibulaires	19	Fem
Dans ce que l' auteur appelle une approche minimaliste , ses écrits utilisent un vocabulaire limité et des phrases courtes pour simuler la manière dont un individu moyen raconterait une histoire .	courtes	19	Fem
Cette technologie radicale développée par l' Université de Floride met en œuvre une conversion de la lumière laser en EUV associée à un procédé d' élimination efficace des particules neutres et chargées qui sont associées à la source plasma .	efficace	26	Fem
Silvestro Chiesa ( né à une date inconnue à Gênes en Ligurie et mort en 1657 dans cette même ville ) est un peintre italien baroque de l' école génoise au XVIIe siècle .	génoise	29	Fem
À l' époque des Ptolémées , elle se divisait en quartiers très différenciés , Éléphantine bénéficiant d' un caractère résidentiel et la rive orientale constituant une agglomération d' ouvriers et artisans .	différenciés	12	Masc
Les Cylindrachetidae sont une famille d' orthoptères caelifères .	caelifères	7	Masc
Il est l' un des mieux adapté au travail sous des latitudes polaires , y compris dans des conditions de vents violents .	violents	21	Masc
En Tunisie , en Egypte ou en Syrie , on constate que les forces armées nationales jouent un rôle déterminant dans un contexte révolutionnaire .	nationales	15	Fem
Pascal Coffez , né en 1957 à Sainghin-en-Weppes ( France ) , est un dessinateur de presse et illustrateur franco-suisse .	franco-suisse	19	Masc
Mihail Lewicki ( né le 16 août 1774 à Pocutie dans l' Empire russe et mort le 14 janvier 1858 à Uniejów ) est un cardinal ukrainien-polonais de l' Église grecque-catholique ukrainienne du XIXe siècle .	grecque-catholique	30	Fem
Dans son rapport , mme Flautre souligne également un domaine où il y a un manque cruel de coordination , alors qu' on en a désespérément besoin .	cruel	16	Masc
Il reçoit la bourgeoisie de Chardonne lors du centenaire de la proclamation de l' indépendance vaudoise , le 24 janvier 1898 .	vaudoise	15	Fem
Ensuite , les phosphates étaient chauffés plusieurs jours dans un récipient hermétique , un creuset , une cornue et on distillait les vapeurs de phosphore , sous l' eau .	hermétique	11	Masc
De 1997 à 2000 , il disputa l' intégralité des matchs de la saison régulière .	régulière	14	Fem
Il a apporté avec lui une grande partie de son abondante bibliothèque port-royaliste et travaille en faisant de nombreux renvois vers cette bibliothèque .	abondante	10	Fem
L' Argentin rejoint alors le club paraguayen de Cerro Porteño .	paraguayen	6	Masc
L' ossature métallique est dissimulée par une voûte en anse de panier bordée de berceaux transversaux , l' ensemble s' élevant à plus de 16 mètres .	transversaux	15	Masc
C' est ainsi que DM , âgé de 31 ans , est appréhendé dans son domicile à Arzew en possession d' un kilogramme de cannabis .	âgé	6	Masc
C' est un endroit tranquille , boisé , bien exposé .	boisé	6	Masc
Après de nombreuses aventures maritimes , elle est capturée par un pirate qui la vend comme esclave à Candie ( Chypre ) ;	maritimes	4	Fem
La pendaison de Riel se révéla impopulaire et controversée et aliéna le soutien des Québécois ( catholiques et culturellement franco-canadiens comme Riel ) au parti conservateur ;	catholiques	16	Masc
Dans les premières années du XIIe siècle , un ermite nommé Clément , avait bâti sa cabane dans cette forêt mal famée et déserte .	famée	21	Fem
Celle-ci est perturbée par les situations politiques intérieures française et algérienne à cette époque , par les relations ambiguës entre la France et son ancienne colonie ainsi que par les tensions diplomatiques et consulaires sous-jacentes .	française	8	Fem
La Collégiale Royale Sainte-Marthe est une église romane située à Tarascon dans le département français des Bouches-du-Rhône .	romane	7	Fem
Le CNFE organise des activités d' échanges et d' accueil réciproques entre professionnels désireux de confronter les systèmes de protection de la jeunesse , les cadres de références et les pratiques respectives .	respectives	31	Fem
Flinders fut le cartographe de la première carte complète d' Australie , comblant les lacunes des précédentes expéditions cartographiques et fut le défenseur le plus important du nom d' Australie pour le nouveau " continent " .	cartographiques	18	Fem
Il convient en outre de ne pas l' utiliser chez les patients ayant eu une hémorragie récente , souffrant d' hypertension aiguë ou présentant des troubles graves des reins , ou encore chez les patients présentant une infection cardiaque .	aiguë	21	Fem
Les fouilles d' une chambre funéraire intacte , effectuées par Mansour Ghaki , ont permis de retrouver un grand nombre de céramiques de diverses origines , locales mais aussi importées .	locales	26	Fem
Une prochaine réunion est prévue mardi	prochaine	1	Fem
Mais la qualité des plats servis ( nous avons pris du poisson ) est très moyenne .	servis	5	Masc
Des dizaines de chansons qui « raillent les impostures » , racontent des histoires sensibles , fraternelles , ironiques , qui vont à l' essentiel , ce que Philippe Corcuff appelle « l' utopie sceptique .	sceptique	34	Fem
L' image de Michel Polnareff devient subliminale puisque dans ses clips et sur les pochettes , on ne verra que sa silhouette ou ses lunettes .	subliminale	6	Fem
La résolution de ces équations modélisant un fluide comme un milieu continu à une seule phase incompressible , si elle est possible , est ardue .	incompressible	16	Fem
La chanson , aux sonorités hard rock , fait référence au cold turkey de Lennon et son épouse Yoko Ono , c'est-à-dire leur brusque tentative de sevrage suite à leur addiction à l' héroïne .	brusque	23	Fem
La pâte était sèche et épaisse , mal cuite , et l' intérieur ( c était une calzone ) était carrément mauvais .	sèche	3	Fem
Au décès de son père , en 1917 , la famille reste sans le sou , alors que le traité de Versailles place la Galicie dans le territoire polonais naissant .	polonais	28	Masc
Les premiers concernés sont les producteurs de viande de boeuf et de mouton , dont on attend aujourd'hui qu' ils vendent leurs produits à des prix égaux ou inférieurs à leurs coûts de production .	égaux	26	Masc
Cette pathologie se manifeste soit dans l' enfance , dans l' adolescence ou à l' âge adulte .	adulte	16	Masc
Le juge , souhaitant en avoir le coeur net , prend une série d' initiatives .	net	8	Masc
Elle repose sur la lecture à haute voix et l' exploration psychologique d' extraits de textes littéraires sélectionnes et répertoriés pour leur pouvoir inducteur d' états émotionnels .	émotionnels	26	Masc
Les réacteurs sont disposés le plus souvent en nacelle sous l' aile ou à l' arrière du fuselage , en nombre pair , ils sont intégrés dans le fuselage dans les avions de combat .	pair	21	Masc
La Centrale féline Belge ( CFB ) est un registre d' élevage belge .	féline	2	Fem
Pablo Correa portera encore le maillot de l' ASNL la saison prochaine .	prochaine	11	Fem
Peut -on plaider la légitime défense ?	légitime	4	Fem
Broché - 285 pages .	Broché	0	Masc
Revenu à Turin , toute sa carrière se déroula en tant que violoniste de la Chapelle Ducale .	Ducale	16	Fem
La section pongiste du club omnisports Fenerbahçe Spor Kulübü est le club pongiste le plus important de la Turquie .	pongiste	2	Fem
La plupart des compétitions internationales sont organisées par l' IARU ( International Amateur Radio Union , Union internationale des radioamateurs ) .	International	11	Masc
On n' utilise pas la chaîne d' assemblage traditionnelle où la voiture défile continuellement devant des ouvriers qui posent les pièces en succession .	traditionnelle	8	Fem
Cette enfance a doté Kathy d' un esprit retord et froid , sans aucune pitié ni compassion , venant se combiner à une très grande intelligence ;	retord	8	Masc
Il s' agit en effet d' une pollution au jaune d' oeuf avarié causée par une patisserie industrielle .	avarié	12	Masc
Le niveau de bruit optimal est supérieur au niveau de bruit de fond minimal théorique ( phénomène de résonance stochastique ) .	minimal	13	Masc
Ce polynôme admet pour racines tous les entiers positifs ou nuls strictement inférieurs à 4 et est de degrés 12 .	nuls	10	Masc
Ainsi , en 2008 , on a mis en lumière un projet de la députation qui a fait une étude durant l' année 2005 mais qui s' est avérée non viable .	viable	30	Masc
À l' hôpital , il a avoué le meurtre et a demandé au personnel infirmier qu' il soit transféré dans un pénitencier .	infirmier	14	Masc
L' intérieur et la décoration sont ravissants et choisis avec goût .	ravissants	6	Masc
Je puis donc m' adresser à tous mes collègues pour les encourager à voter pour ce rapport , et à travailler dans ce sens dans leurs pays respectifs , auprès des gouvernements , des organisations et des médias .	respectifs	27	Masc
- si vous avez ou avez eu une hypertension ( tension artérielle élevée ) sévère non contrôlée .	artérielle	11	Fem
La quatrième et dernière tranche est prévue pour être terminée en 2020 .	quatrième	1	Fem
Les thérapies cognitives et comportementales sont probablement le type de psychothérapie le plus efficace pour soigner les psychoses chroniques .	chroniques	18	Fem
Les habitations de Manarola sont des maisons-tours génoises typiques .	typiques	8	Fem
Il s' intéresse donc à la médecine traditionnelle asiatique , au yoga , au tai-chi , au Qi Gong et à la méditation .	asiatique	8	Fem
L' huile de jatropha est une huile végétale extraite des graines du Jatropha curcas , un arbuste originaire d' Amérique centrale et qui s' est répandu en Afrique et en Asie .	végétale	7	Fem
L' ordre positif fut donné à la 68e heure .	positif	2	Masc
La réorganisation de l' impôt sur l' huile d' olive , principale ressource agricole du pays , nécessite une gestion plus stricte dont Caïd Essebsi tire encore une fois des louanges .	stricte	21	Fem
Excellent ... cadre agréable , serveurs sympathiques avec beaucoup d' humour , nourriture très bonne , très bon rapport qualité prix !	Excellent	0	Masc
Le terme Grenouille verte est un nom vernaculaire ambigu en français qui peut désigner plusieurs espèces de grenouilles de la famille des Ranidae parmi les Amphibiens .	verte	3	Fem
Le 2 juillet 1850 , le général de Gramont fait adopter une loi relative aux mauvais traitements infligés aux animaux domestiques .	domestiques	20	Masc
Le Renown tenta la poursuite , mais à 04h00 il perdit le contact visuel du fait du mauvais temps .	visuel	13	Masc
Son dos est gris violacé , son ventre de couleur crème .	crème	10	Fem
Il a participé à des expériences visant à déterminer la nature et les propriétés des particules de basse énergie dans la magnétosphère de la Terre et l' espace interplanétaire .	interplanétaire	28	Masc
L' intervention musclée et directe de la France dans la région semble , au contraire , rapprocher les tribus locales des terroristes et autres contrebandiers et trafiquants d' armes , qui écument ces régions arides et inhospitalières .	inhospitalières	36	Fem
Bien que plutôt présente dans les églises catholiques , la croix celtique est présente aussi dans certaines églises protestantes , particulièrement celles qui se réfèrent à leur origine irlandaise ou écossaise .	catholiques	7	Fem
Industrie Agro-alimentaire , Audit en Santé , Accréditation-Certification , Industrie pharmaceutique , Industrie des dispositifs médicaux , EHPAD , Biologie-Santé	Agro-alimentaire	1	Fem
Sinon , l' ouverture d' une salle d' imagerie vasculaire et cardiologique est prévue pour 2007 .	cardiologique	11	Fem
La population de la commune est relativement âgée .	âgée	7	Fem
L' imposture consiste donc à assimiler le mot « abstraction » à gribouillis informe , alors qu' il désigne une réalité précise organisée , même si elle n' est pas directement perceptible par les sens .	informe	13	Masc
Le gain de performance global est variable ( nombre de cores , textures chargées ou en chargement ... ) , mais est d' environ 20 % pour les mono-cores , et de 40 % pour les dual-cores .	chargées	13	Fem
L' offre n' est pas négociable pour Namur .	négociable	5	Fem
La microscopie confocale est très utilisée aujourd'hui en biologie ainsi qu' en sciences des matériaux .	confocale	2	Fem
Après avoir lu la traduction en français , par l' Abbé Joachim le Grand , il estime qu' une version plus condensée serait « utile et profitable » .	condensée	21	Fem
Il fréquente les récifs côtiers où les eaux sont claires et peu profondes .	claires	9	Fem
Cette boutique est tendance et abordable au niveau des prix .	abordable	5	Fem
Dans la longue histoire des rivalités entre les lignées bonpo et bouddhiste , le mystérieux royaume occupe la place symbolique de l' « autre Tibet » , opposé à l' empire tibétain .	tibétain	31	Masc
Cela est particulièrement vrai dans A Chaste Maid in Cheapside , qui offre une vision panoramique d' une Londres entièrement peuplée d' habitants corrompus et qui n' épargne aucune classe sociale .	corrompus	23	Masc
Jabba mène une vie de plaisirs dans son palais , et reçoit les visites de célèbres contrebandiers .	célèbres	15	Masc
L' archevêque dit aussi qu' il faut suivre les voies de Dieu pour construire sa vie , en fait les vertus cardinales et théologales .	cardinales	21	Fem
Fleurs solitaires et terminales , campanulées et pendantes , avec 4-6 sépales bleu violacé , lancéolés ( long : 25-50 mm ) , à l' ovaire pubescent .	lancéolés	15	Masc
Il est élu le député du tiers état aux États généraux par la sénéchaussée de Riom avec 163 voix sur 304 votants .	généraux	10	Masc
La reddition de Santoña fut donc ressentie par leurs anciens alliés comme une véritable traitrise qu' ils désignèrent sous le nom de « trahison de Santoña » .	anciens	9	Masc
L' objectif pastoral de ces rencontres lui semble être d' attirer quelques jeunes initialement plus tièdes dans le cercle des enthousiastes .	pastoral	2	Masc
C' est l' un des plus anciens cimetières mérovingiens de Wallonie .	anciens	6	Masc
Légumes mal nettoyés , manque de goût , n' a pas demandé notre satisfaction ... à éviter .... dommage ... la carte est alléchante ...	alléchante	23	Fem
Les lois exceptionnelles furent aussitôt abrogées dès le nouveau doge élu et les institutions originelles de la République reprirent leur fonctionnement normal .	exceptionnelles	2	Fem
Au Sri Lanka , cet oiseau est connu sous le nom de « Kehibella » en langue cinghalaise .	cinghalaise	17	Fem
Incroyable cascade de saveur dans la bouche .	Incroyable	0	Fem
Le crabe de cocotier adulte n' est pas apte à la nage et se noierait au bout de quelques heures malgré son système de branchies rudimentaire , probablement un vestige de son évolution .	apte	8	Masc
Ce à quoi Alberto Manguel ajoute « l' argument qui justifie la reproduction électronique par les dangers qui menacent le papier est un faux argument » car « les instruments des médias électroniques ne sont pas immortels » .	électroniques	32	Masc
Huit jours après , Didier Schuller prenait la fuite en République dominicaine sur les conseil de son avocat Me Francis Szpiner et de la cellule juridique de l' Elysée ( le ' cabinet noir ' ) .	dominicaine	11	Fem
Centaurea derventana est une espèce de plante herbacée vivace de la famille des Astéracées et du genre Centaurea .	vivace	8	Fem
Enfin , les précipitations s' établissent à 598,3 millimètres annuels , avec une moyenne mensuelle proche de cinquante millimètres et une pointe à soixante-trois millimètres en mai .	annuels	9	Masc
On trouve différentes activités d' anticipation : la neutralisation d' une action prévisible , le stoppage d' une attaque à son démarrage et le contre dans le développement de l' offensive adverse , etc.	adverse	31	Fem
C' est plus un titre qu' un nom authentique , repris pour citer de nombreuses divinités babyloniennes et assyriennes .	babyloniennes	16	Fem
La question des limites du territoire du bidon Tibet peut - être abordée sous les angles géographique , ethnique ou politique , mais aussi historique et culturel selon le contexte .	ethnique	18	Masc
Depuis la première jusqu' à la XXVIe dynastie , ce sont environ une dizaine de temples qui ont été construits sur le site .	XXVIe	6	Fem
Valéry Giscard d' Estaing , d' après ses mémoires , est surpris par cette attaque qui repose sur des éléments selon lui totalement faux ( il aurait reçu une plaquette de diamants de trente carats ) .	faux	23	Masc
Mais les pizza y sont très bonne et le prix est plus que correct .	correct	13	Masc
L' alcoolisme ou " alcoolo-dépendance " est une maladie chronique qui englobe la consommation problématique d' alcool et les troubles qui en résultent tant au niveau psychique que physique .	chronique	9	Fem
Les habitations de Manarola sont des maisons-tours génoises typiques .	génoises	7	Fem
Les constructions neuves sont bien plus présentes que la moyenne française : en 2007 , 29,8 % des résidences principales dataient de 1990 et plus contre 10,4 % en France .	neuves	2	Fem
Il travaillait en relation avec Jean-Claude Albessard , responsable de la société pour l' Asie , terrassé en mai 2000 par un cancer foudroyant .	foudroyant	23	Masc
La présence d' une abondante forêt , fournissant l' indispensable combustible , liée à l' existence du minerai de fer exploitable à ciel ouvert , a incité les hommes à créer " .	abondante	4	Fem
Elliptiques et lancéolés , ils sont entre 40 et 50 sur la floraison du printemps , à l' automne la fleur est semi-double , elle dispose de beaucoup moins de sépales , entre 10 et 20 seulement .	lancéolés	2	Masc
Ces changements rejetés par les journalistes et les spectateurs , il démissionne en juin 1998 , poursuivant la présentation des émissions Direct et Futur antérieur .	antérieur	24	Masc
Cette même année , Le joueur natif de Coventry est de nouveau retenu avec les Barbarians pour deux nouveaux matchs .	natif	6	Masc
Le 83e régiment d' infanterie territoriale est un régiment d' infanterie de l' armée de terre française qui a participé à la Première Guerre mondiale .	83e	1	Masc
En octobre 2009 , un descendant de Naosuke s' est réconcilié avec les habitants de Fukui pendant une cérémonie commémorative marquant le 150ème anniversaire de l' exécution .	commémorative	19	Fem
Ainsi , Charlemagne ressuscite le titre impérial en 800 ;	impérial	6	Masc
L' utilisation de sociétés-écrans basées dans des paradis fiscaux ( voir société panaméenne et fiduciaire suisse ) a empêché de retracer les flux financiers .	panaméenne	12	Fem
Adanggama est une réalisation cinématographique ivoirienne produite en 2000 .	ivoirienne	5	Fem
La voix originale du géant Willie est donnée par Billy Gilbert , acteur reconnu pour ces mimiques de violentes éruptions nasales d' où la scène avec la poudre de tabac .	originale	2	Fem
Il est relativement plat et donc plus propice à l' agriculture que le reste de la province .	propice	7	Masc
Au-delà de ces cas précis , la gouvernance argentine n' a jamais pu trouver un terrain d' entente durable avec les investisseurs étrangers dans des secteurs sensibles .	sensibles	26	Masc
L' un des effets secondaires de l' hydrogénation incomplète des matières grasses est l' isomérisation de certains composés insaturés avec en particulier production d' acides gras trans alors que ce sont au contraire les formes cis qui prédominent naturellement .	trans	26	Masc
