La condition d' évolution naturelle ( CEN ) condition d' évolution spontanée ( CES ) est une inéquation qui permet de prévoir l' évolution " naturelle " ou " spontanée " d' un système chimique .	spontanée	29	Fem
D' azur au lion d' or , sautant , armé , couronné , lampassé de gueules , au canton d' argent chargé de six mouchetures d' hermines .	lampassé	13	Masc
Motivé par la charité chrétienne , la communauté a changé un vieil immeuble abanbonné où se pratiquaient d' ailleurs de nombreux échanges de drogues en ce logement sûr , propre et abordable qu' il est aujourd'hui .	vieil	11	Masc
Son écorce peu épaisse est à l' état juvénile gris-verte , lisse et luisante .	gris-verte	9	Fem
Il développa une critique sérieuse des institutions libérales depuis le milieu des années 1990 , durant lesquelles il publie ses premiers articles académiques , en particulier contre la théorie politique de John Rawls .	libérales	7	Fem
Le leader français du câble assurera la conception , la fabrication et la pose du nouveau câble sous-marin de 140 km à travers le détroit de Skagerrak entre la péninsule danoise du Jutland et la Norvège .	sous-marin	17	Masc
À la naissance les abeilles femelles naissent égales , et sont toutes nourries de gelée royale jusqu' au 3ème jour .	égales	7	Fem
Elle est très attentionnée avec son frère , et organise souvent des " plans " romantiques pour Belldandy et Keichi .	romantiques	15	Masc
D' un point de vue environnemental , c' est une technologie très attrayante , en principe , puisque tout ce qui sort de l' échappement , c' est de l' eau .	attrayante	12	Fem
Nacional termine le championnat à égalité de point avec Club Cerro Porteño mais l' emporte au terme de barrages très conflictuels .	conflictuels	20	Masc
" Il s' agit de développer des services adaptés qui respectent nos contenus " .	adaptés	8	Masc
Les croisillons sont voûtés d' ogives bombées , constituées de deux gros boudins séparés par une fine arête .	bombées	6	Fem
Cela se concrétise dès 1792 puisque les saisies révolutionnaires de biens du clergé notamment sont effectuées selon le décret de 1789 .	révolutionnaires	8	Fem
L' esprit du Zen , qui a imprégné toute la période précédente , cède la place à un confucianisme étriqué qui marque jusqu' à la fin ( 1868 ) l' époque Tokugawa ( dite époque Edo ) .	étriqué	19	Masc
D' autres membres commencèrent également à partager leurs expériences et découvertes , tel Vaucouleurs , qui a travaillé sur le poids de l' air et développé une version primitive de baromètre .	primitive	28	Fem
Il le ramène en Transylvanie , l' occasion pour les Vampires , et en particulier le trio infernal , d' accueillir le nouveau venu comme il se doit .	infernal	17	Masc
La corolle de la fleur -- bleue , mais quelques variétés horticoles sont blanches -- est courte , très semblable à celles des espèces du genre Myosotis .	bleue	6	Fem
C' est aussi , selon lui , une région dangereuse à cause des conflits ethniques et de la confrontation d' intérêts divergents .	dangereuse	9	Fem
En 1821 , l' architecte anversois Pierre Bruno Bourla entreprit de les convertir en prison correctionnelle , en y aménageant de grandes salles de détention ;	correctionnelle	15	Fem
Elle a été utilisée pour diverses manifestations sportives , manœuvres militaires ou rassemblement , comme lors de la Grande Charte de 1838 , conduisant l' économiste Friedrich Engels à la surnommer " le Mont Sacré de Manchester " .	sportives	7	Fem
Des diminutions inexpliquées de l' hématocrite , de l' hémoglobine ou de la pression artérielle peuvent indiquer une hémorragie .	artérielle	14	Fem
Manifestement , l' arrière du corps , avec sa large queue capable d' onduler et ses membres postérieurs en forme de pagaie , avait une vocation aquatique » .	postérieurs	17	Masc
Le mâle présente un plumage tricolore , dans l' ensemble brun sombre avec les ailes gris argenté aux extrémités noires .	brun	10	Masc
L' Institut royal des sciences naturelles de Belgique est une institution de l' État fédéral belge .	royal	2	Masc
Les lumières blanches ( une pour chaque tireur ) indique qu' une touche a été porté mais sur une zone non-valable ( exclusivement pour le fleuret ) .	non-valable	20	Fem
Bien que l' esprit et l' œil alerte à voir la comédie dans les choses humaines persistent , le problème des relations humaines -- et notamment familiales -- est pris beaucoup plus au sérieux que dans ses premiers romans .	humaines	22	Fem
Celle-ci offre également aux randonneurs dix stations d' environnement informatives .	informatives	9	Fem
Le couple continue alors sa vie , malgré le choc psychologique .	psychologique	10	Masc
L' interstate 535 est une autoroute inter-états auxillaire de l' interstate 35 , à la fois au Minnesota et au Wisconsin , plus particulièrement dans la ville de Duluth .	auxillaire	7	Fem
Les critères morphologiques considérés sont donc davantage une convergence évolutive entre les Proboscidiens et les autres familles que des critères de parenté .	évolutive	9	Fem
Il y a un étang dans le lieu-dit de Périgny ( visible par satellite ) .	visible	11	Masc
Une trop grande propreté , telle que décrite dans l' « hypothèse hygiéniste » pourrait favoriser l' apparition de phénomène allergique .	hygiéniste	12	Fem
Niu Mo Wang signifie littéralement « Roi Taureau Démoniaque » .	Démoniaque	8	Masc
La résistance se rallie alors à la base secrète de White Forest , une ancienne base de l' Armée rouge , disposant d' un silo de fusées , cachée au milieu de la forêt et des montagnes .	secrète	8	Fem
Considérant que les Etats membres se sont engagés à assurer , en coopération avec l' organisation des Nations Unies , le respect universel et effectif des droits de l' homme et des libertés fondamentales .	universel	22	Masc
Si vous partez en expatriation ou détachement , votre employeur vous recommandera certainement une banque locale auprès de laquelle vous pourrez ouvrir un compte en devises ou en monnaie locale convertible afin de vous faciliter les opérations bancaires .	convertible	30	Fem
Le Festival international du film de Fajr est le festival du film annuel de l' Iran , qui se tient à Téhéran .	annuel	12	Masc
Les hammams traditionnels syriens sont surtout remarquables par leur décoration raffinée qui leur donne l' aspect de palais .	raffinée	10	Fem
Cette décision pontificale s' explique par la cristallisation des tensions nouvelles qui opposent Aicard au comte ainsi qu' au pape .	pontificale	2	Fem
Hollaback Girl est une chanson du premier album solo de Gwen Stefani Love .	solo	8	Masc
Les tapas étaient variés , la quantité plus que respectable et les prix raisonnables ( compte tenu du rabais accordé ) .	respectable	9	Fem
Le virus est réactivé périodiquement de sa latence , et l' ADN viral est détectable chez 20-25 % de la population adulte saine aux États-Unis .	adulte	21	Fem
Plusieurs médicaments par voie orale et ne nécessitant pas de surveillance sanguine régulière sont en cours de développement .	orale	4	Fem
Shusterman poursuit cette réflexion dans plusieurs essais subséquents tels Practicing Philosophy ( 1997 ) , Performing Live ( 2000 ) et Surface and Depth ( 2002 ) .	subséquents	7	Masc
La marque développe un réseau de boutiques mono-marques qui s' ajoute aux distributeurs existants ( grands magasins , boutiques dans les aéroports ) .	mono-marques	7	Fem
Avant toutes manipulations ( mise en place ou retrait de la cape cervicale ) , il est très important de se laver les mains , pour éviter l' introduction de bactéries dans le vagin .	cervicale	12	Fem
Les animaux atteints sont généralement sensibles à l' ivermectime , composant vermifuge .	sensibles	5	Masc
Elle peut aussi fréquenter les marais côtiers et la mangrove .	côtiers	6	Masc
Elles sont formées de trois compilations successives de constitutions impériales postérieures au code .	postérieures	10	Fem
Appartenant à la famille Ohta , Tomoe doit également s' assurer du maintien des traditions insulaires .	insulaires	15	Fem
Fleurs solitaires et terminales , campanulées et pendantes , avec 4-6 sépales bleu violacé , lancéolés ( long : 25-50 mm ) , à l' ovaire pubescent .	violacé	13	Masc
En parfaite femme d' intérieur , elle a pu , lors de ce repos bien mérité , s' occuper de sa maison , de ses fleurs .	mérité	15	Masc
La proportion de ces couples ( appelés endogames ) était la plus forte chez les immigrés turcs , phénomène que l' on rencontre un peu partout en Europe au sein des originaires de Turquie .	endogames	7	Masc
Le journaliste de Chicago Tribune Greg Kot note des « incohérences inexplicables » et déclare « l' album semble maigre , à moitié fini » .	inexplicables	11	Fem
Le " scandale des piastres " fut ramené à l' état de détail exotique et insignifiant , indigne d' être mentionné dans les manuels d' histoire .	insignifiant	15	Masc
Dans d' autres documents ( 2 ) cette branche mineure a été aussi définie , dans le passé , avec les noms de Una et Praealtum .	mineure	9	Fem
Après la Seconde Guerre mondiale , le palais a abrité le Cercle des officiers de la république socialiste soviétique de Lituanie .	soviétique	18	Fem
Pour les communes de moins de 10_000 habitants , les recensements ont lieu tous les cinq ans , les populations légales intermédiaires sont quant à elles estimées par calcul .	légales	20	Fem
Citons aussi Pierre de Coubertin : « L' indispensable nécessité de la Culture Physique et de la Culture du Caractère n' exclut pas la formation de l' intelligence et de la sensibilité .	indispensable	8	Fem
Ces abeilles métisses sont plus agressives que les abeilles des races dont elles sont issues .	métisses	2	Fem
Le satellite , d' une masse de 94 kg a été placé sur une orbite héliosynchrone de 681 x 561 km , et est contrôlé depuis la station de Redu , en Belgique .	héliosynchrone	15	Fem
Mithrandir est un nom sindarin qui se décompose en « gris » et « errant , pèlerin » .	errant	14	Masc
Elles abritent également une collection de plus de 2_000 enregistrements d' entrevues liées à l' art et publient une publication bi-annuelle appelée Archives of American Art Journal qui met en valeur les collections .	bi-annuelle	20	Fem
Le Parti libéral brésilien ( en portugais : Partido Liberal brasileiro ) est un parti politique monarchiste fondé en 1837 et éteint au moment de la disparition de l' Empire brésilien , en 1889 .	monarchiste	16	Masc
Mais Shingen reste imperturbable .	imperturbable	3	Masc
Michael B. Oren ( né en 1955 ) est un historien israélien né aux États-Unis .	israélien	11	Masc
Les forces impériales étaient conduites par Masashige Kusunoki et Yoshisada Nitta , alors que leurs adversaires étaient commandés par Takauji Ashikaga .	impériales	2	Fem
En France , on utilisait , en principe , un plomb antimonieux , dont le point de fusion est inférieur à 4000 ° C.	antimonieux	11	Masc
Je vous conseille vivement ce charmant petit resto , de plus c' est ouvert même le dimanche et on y sert tard le soir .	charmant	5	Masc
Locataires éventuels , fuyez cette agence si vous ne voulez pas y laisser de l' argent .	éventuels	1	Masc
Ce récit d' une guerre mythique entre deux peuples qui ne sont pas humains , est capital pour la compréhension de la mythologie celtique irlandaise .	irlandaise	24	Fem
Butchart Gardens est un groupement de jardins d' exposition florale situé à Brentwood Bay , Colombie-Britannique , Canada , près de Victoria sur l' Ile de Vancouver .	florale	9	Fem
En géographie , le 75e parallèle sud est le parallèle joignant les points de la surface de la Terre dont la latitude est égale à 75 ° sud .	75e	4	Masc
Elle y remporte huit médailles : quatre en argent et quatre en bronze , se classant à la 26e place au tableau des médailles .	26e	18	Masc
Largo s' envole pour Venise afin de porter secours à son amie , laissant de côté d' importantes négociations commerciales qui le mettent face au dangereux Cartel pétrolier dont Robert Cotton dirige la police secrète .	secrète	34	Fem
Il purifie tout car il supprime les odeurs nauséabondes .	nauséabondes	8	Fem
Les deux pieds avant sont d' un seul bloc avec le rail vertical sur lequel coulisse le support horizontal supportant la toile .	vertical	12	Masc
La devise du PAN « Pour une patrie ordonnée et généreuse , et une vie meilleure et plus digne pour tous » fut adoptée .	généreuse	10	Fem
Les malheureux étaient encore en vie et moururent après une longue et douloureuse agonie .	douloureuse	12	Fem
Comme tous les ordres monastiques français , l' ordre des Carmes est aboli par le décret des 13 et 19 février 1790 .	monastiques	4	Masc
Le syndicat mixte du Pays des Vallées d' Anjou ( SMPVA ) regroupe six communautés de communes : Beaufort-en-Anjou , Canton de Baugé , Canton de Noyant , Loir-et-Sarthe , Loire Longué , Portes-de-l'Anjou .	mixte	2	Masc
Le sushi à la mayonnaise , c' est aussi palpitant qu' un pot au feu au ketchup ou une blanquette de veau avec de la sauce soja : c' est pas inventif , c' est n' importe quoi .	palpitant	9	Masc
Entourée de figures saintes , dans un décor autant majestueux , c' est également une Conversation sacrée car des groupes sont constitués semblant converser ;	majestueux	9	Masc
Le mâle présente un plumage tricolore , dans l' ensemble brun sombre avec les ailes gris argenté aux extrémités noires .	gris	15	Masc
Le genre Lutzia comprend 2 espèces d' Amérique Centrale et du Sud Lutzia allostigma et Lutzia bigotii trois espèces australasi Lutzia shinonagai , Lutzia fuscana et Lutzia vorax et une espèce africaine Lutzia tigripes .	Centrale	8	Fem
La chambre est bien agencée et la salle de bain très spacieuse .	spacieuse	11	Fem
La sanction est immédiate : un seul coup porté en étant invisible , et les autres coups portés en étant visible ne comptent pas .	visible	20	Masc
Les AGO C.I , C.II et C.III étaient des biplans biplaces de reconnaissance allemands utilisés durant la Première Guerre mondiale .	biplaces	10	Masc
Les défis de la société sécularisée sont d' un autre ordre puisque celles-ci prennent le modèle d' une société ouverte , où il est difficile de vivre en communautés séparées .	séparées	29	Fem
Après un bref séjour dans un hôpital psychiatrique , elle s' engage dans une série de batailles légales contre les personnes qui l' ont faite interner et les journaux qui ont clamé qu' elle était folle .	légales	17	Fem
Les asques renferment 8 ascospores filiformes qui vont contaminer les stigmates d' un hôte ( Poacée ) puis l' ovaire , où le mycélium forme un capuchon blanc , c' est la forme conidienne ( Sphacelia segetum ) .	filiformes	5	Fem
En ce qui concerne les sanctions pénales , la commission a publié deux rapports [ 5 ] sur l' application de la décision - cadre susmentionnée , qui font état d' un niveau satisfaisant de mise en œuvre .	pénales	6	Fem
J' ai également eu la chance de goûter à quelques pizzas ( cuites au four à bois ) et quelques entrées qui sont toutes aussi excellentes les unes que les autres .	excellentes	25	Fem
Rob-Vel lui attribue un frère jumeau , tandis que Franquin lui offre un oncle dans L' héritage .	jumeau	5	Masc
Comme il entrait dans la nourriture ordinaire des soldats romains , l' ail est devenu le symbole de la vie militaire .	ordinaire	6	Fem
De concert avec les gestionnaires de la Commission scolaire , elle participera à la révision et à l' optimisation des pratiques administratives et développera des outils facilitant la gestion de la présence au travail .	scolaire	8	Fem
Pour bénéficier de ce taux avantageux et subventionné , il fallait justifier le transfert et obtenir l' aval de l' Office indochinois des changes ( OIC ) .	indochinois	21	Masc
Elle aborde à la fois les aspects théoriques de l' algorithmique et des aspects plus expérimentaux .	expérimentaux	15	Masc
La Banque populaire de Chine doit encore déployer beaucoup d' efforts pour calmer l' économie , car la masse monétaire et l' octroi de nouveaux prêts bancaires continuent de fortement augmenter . "	bancaires	26	Masc
Le but marqué en seconde mi-temps par Gianluca Zambrotta , qui donne l' avantage à la Juve , est anecdotique quant à la qualification .	anecdotique	19	Masc
Pour lui , c' est cette seule option qui lui garantira une participation équitable à la gouvernance mondiale .	équitable	13	Fem
Avant de me rendre dans les camps , j' ai rencontré un représentant du Front Polisario à Londres qui m' a dit : « les camps sont l' un des endroits les plus sûrs de cette planète » .	sûrs	33	Masc
Le groupe vient de perdre deux anciens membres historiques .	anciens	6	Masc
Les frontières ouest ( la Saône ) et nord du futur département sont alors fixées et ont constitué une limite culturelle entre le nord ( langue d' oïl ) et le sud ( franco-provençal ) .	franco-provençal	33	Masc
Ses flancs sont tachetés de noir et son marqués de lignes verticales et obliques jaunes .	jaunes	14	Fem
Bien que l' esprit et l' œil alerte à voir la comédie dans les choses humaines persistent , le problème des relations humaines -- et notamment familiales -- est pris beaucoup plus au sérieux que dans ses premiers romans .	humaines	15	Fem
Il n' existe pas de données concernant un éventuel passage de la bivalirudine dans le lait maternel .	maternel	16	Masc
Elle collabore notamment avec le site Spank-Magazine pour lequel elle a réalisé bon nombre de dessins et d' habillages graphiques .	graphiques	19	Masc
Il semble vraisemblable que cette œuvre comportait quelques restes du style baroque tardif .	vraisemblable	2	Masc
Mais dans les terrains sans formations superficielles meubles , il est beaucoup plus difficile de connaître l' extension passée et de différencier par exemple entre pergélisol continu et discontinu .	continu	26	Masc
L' union des Professionnels du Tourisme Naturiste du Cap d' Agde tiendra son assemblée Générale le mercredi 1er Juin à 15h .. en la salle de réunion de l' USCQN rond point du Bagnas au Cap d' Agde .	rond	30	Masc
Albert Legrand Baning , né le 19 mars 1985 , est un footballeur camerounais , évoluant au poste de milieu de terrain défensif .	camerounais	13	Masc
Il a occupé la fonction de Ministre de la Sécurité Intérieure puis des Affaires Etrangères dans le gouvernement d' Ehud Barak .	Etrangères	14	Fem
Rochelle Ballard est une surfeuse professionnelle hawaïenne née le 13 février 1971 à Montebello , Californie	hawaïenne	6	Fem
Pour bénéficier de ce taux avantageux et subventionné , il fallait justifier le transfert et obtenir l' aval de l' Office indochinois des changes ( OIC ) .	subventionné	7	Masc
En contrepartie , les pilotes chaussés par le pneumatique Michelin seraient inéligibles à inscrire des points .	inéligibles	11	Masc
Les protocoles utilisés peuvent aussi être beaucoup plus complexes et impliquer par exemple des plages temporelles pendant lesquelles seul l' animal peut agir pour être « récompensé » .	temporelles	15	Fem
Elle décide alors , avec son amie Kenzi , de devenir détective privé et de rester neutre , chaque Fae pouvant faire appel à ses services quel que soit leur camp .	neutre	16	Masc
L' année suivante , lors des Jeux olympiques de Barcelone , l' Union des républiques socialistes soviétiques n' existe plus .	soviétiques	16	Fem
Vous avez gagné un client régulier !	régulier	5	Masc
Jusqu' à 20_000 guerriers burgondes y furent exterminés ( 436 / 437 ) et le roi burgonde y trouva la mort .	burgonde	16	Masc
Il fonda le Forum du Théâtre Contemporain en 1991 .	Contemporain	6	Masc
Une lésion de l' amygdale survenue au début de la vie , entraîne un déficit de la reconnaissance des expressions faciales de peur mais aussi de colère , de surprise et de dégoût .	faciales	20	Fem
Et par le biais de l' activité théâtre , ils se sont intéressés à l' expression orale et à la mise en scène avec un intervenant , Julien Georges , maître de théâtre .	orale	16	Fem
Le chanteur entame alors une tournée à travers les États-Unis , durant laquelle son déhanchement scandalise l' Amérique puritaine , mais entraîne dans son sillage des milliers d' adolescents qui font de lui une véritable idole .	puritaine	18	Fem
Enfin , en matière d' éducation , la partie algérienne transmettra à la partie tanzanienne un quota de bourses pour l' année universitaire 2011-2012 .	tanzanienne	14	Fem
Alors , la mère peut aller se reproduire , mais quel prix terrible à payer pour l' accumulation de ce polluant dans ces animaux - la mort de leur premier né .	polluant	20	Masc
André Gérin , député du Rhône et président de la mission sur le voile intégral , remettra le 26 janvier 2010 son rapport à Nicolas Sarkozy .	intégral	14	Masc
Gîte citadin ( 3 épis aux Gîtes de Wallonie ) 4 chambres à thème ( Inde , Far West , Angleterre , Jungle ) qui vous apporteront un dépaysement total lors de votre séjour à Stavelot .	citadin	1	Masc
Lorsqu' il a fallu fixer des frontières européennes à partir de quelque chose de tangible et donc physique , des obstacles naturels ont été désignés .	naturels	21	Masc
La clairance de la bivalirudine est similaire chez les patients à fonction rénale normale et chez les patients présentant une légère insuffisance rénale .	rénale	22	Fem
Il termine l' année sur de meilleures impressions avec une 5e place à Kranjska Gora et une 7e à Lenzerheide pour terminer à la 12e place du classement du slalom .	7e	17	Fem
Cet assassinat ( surnommé Operación Ogro , Ogro = L' ogre , le surnom donné par ses opposants ) constitue le principal coup porté par ETA à la dictature franquiste .	franquiste	29	Fem
Lorsqu' ils n' y sont pas , leur plumage est plus variable , allant d' une petite tache dorée sans bande noire à un plumage presque de saison nuptiale .	variable	11	Masc
À sa mort il était membre du Comité permanent sur la nomenclature ornithologique du Congrès ornithologique international ( COI ) .	permanent	8	Masc
Pour résumer , sous des allures alternatives et conviviales ce restaurant n' est qu' une supercherie qui va non seulement vous faire passer une soirée médiocre mais aussi bien entammer votre portefeuille .	alternatives	6	Fem
Le Sahara occidental est en partie occupé depuis 1975 par le Maroc .	occidental	2	Masc
L' effet indésirable le plus fréquent avec Angiox ( observé chez plus d' un patient sur 10 ) est le saignement bénin .	bénin	21	Masc
Quant à l' Europe et plus globalement , le monde occidental , il doit se réveiller , arrêter de soutenir des dictatures non-viables et tout faire pour appuyer des mouvements qui visent le changement pluraliste dans la région .	non-viables	22	Fem
Le premier forage révèle des indices très probants .	probants	7	Masc
En chimie des polymères , il peut être utilisé comme monomère participant à la formation de polymères réticulés ( voire de gels réticulés selon les protocoles employés ) .	réticulés	17	Masc
Petit bémol : les amateurs de vin doivent s' attendre à une addition un peu salée ...	salée	15	Fem
La collection iconographique Maciet , créée par Jules Maciet de 1885 à 1911 , et enrichie jusqu' en 1996 , regroupe un million d' images : gravures et photographies originales sont en cours de numérisation .	iconographique	2	Fem
Le cornouiller sanguin ( Cornus sanguinea ) est un arbuste à feuilles caduques de la famille des cornacées .	caduques	12	Fem
Les charges sont les suivantes : trahison , sédition , écrits incendiaires , et menées hostiles dans le but d' expulser les autorités espagnoles .	espagnoles	23	Fem
" Le niveau de confiance dont bénéficie le chef du gouvernement est exceptionnel après plus de deux ans et demi d' exercice du pouvoir .	exceptionnel	12	Masc
Les exemples donnés ne sont pas , selon la communauté scientifique dans son ensemble , probants .	scientifique	10	Fem
Depuis 4 mois , avec une science avisée , le capitaine du génie Gunther dirigeait par la sape et par la mine les travaux de siège régulier qui devaient ouvrir la voie à notre infanterie .	régulier	26	Masc
Le rehaussement de ce même clocher à partir de 1431 ne fut pas pour arranger ce problème , auquel il ajoute le poids élevé du troisième étage et du toit pyramidal en pierre .	pyramidal	30	Masc
Le fœtus est considéré comme arrivé à son terme de développement entre la 35e et 39e semaine , ce qui signifie qu' on le considère apte à vivre en dehors de l' utérus .	35e	13	Fem
La Brigade nord-africaine est créée au début de l' année 1944 par Henri Lafont et le nationaliste algérien Mohamed el-Maadi ( ancien officier français membre du mouvement d' extrême-droite la Cagoule ) .	nord-africaine	2	Fem
QUELS SONT LES EFFETS INDESIRABLES EVENTUELS	EVENTUELS	5	Masc
Outre la supercherie indigne de l' art du toreo , l' afeitado , en ôtant le diamant ou partie dure de la corne , entraîne l' éclatement des cornes au moindre choc .	indigne	3	Fem
Leur dîner en tête à tête dans un restaurant huppé de Londres ne s' est cependant pas déroulé comme prévu .	huppé	9	Masc
1 . Toute personne a droit au travail , au libre choix de son travail , à des conditions équitables et satisfaisantes de travail et à la protection contre le chômage .	équitables	19	Fem
Quel est le bénéfice démontré par Aclasta au cours des études ?	Quel	0	Masc
Cadell était l' un des six fils guerriers du puissant roi Rhodri le Grand mentionnés par leur contemporain Asser .	guerriers	7	Masc
Il faut attendre que la solution réfrigérée revienne à température ambiante avant de l' administrer .	ambiante	10	Fem
Il part le 16 septembre de l' année suivant en République dominicaine où il devient professeur au Séminaire de San José de Las Matas jusqu' en 1963 .	dominicaine	11	Fem
