« J' essayais de saisir dans son ensemble cette vision déformée de l' Histoire : l' Europe assez puissante pour battre les Turcs et lancer des bateaux sur les mers .	puissante	18	Fem
La base sous-marine de Brest est un immense bunker de la Seconde Guerre mondiale , destiné à abriter la 1ère et la 9ème flottille de U-boots de la Kriegsmarine .	sous-marine	2	Fem
Le CNC estime que pour permettre la confiance du consommateur ( et parfois des employés et actionnaires ) , la communication environnementale sur les produits doit être sincère , objective , claire , adaptée et précise .	environnementale	21	Fem
Ritmx est un fournisseur de services de distribution et un éditeur de solutions logicielles dédiées au transport public en France et à l' international .	logicielles	13	Fem
Jacques Fauvet signe le lendemain un éditorial accusateur intitulé " La vérité et l' honneur " .	accusateur	7	Masc
La maladie peut apparaître de manière irrégulière et épidémique .	irrégulière	6	Fem
Signes de solidarité ou contrainte de sécurité , plusieurs commerçants ont fermé boutique et ont ainsi perturbé l' approvisionnement quotidien des ménages et des établissements hôteliers des alentours .	hôteliers	25	Masc
Elle a été utilisée pour diverses manifestations sportives , manœuvres militaires ou rassemblement , comme lors de la Grande Charte de 1838 , conduisant l' économiste Friedrich Engels à la surnommer " le Mont Sacré de Manchester " .	Sacré	34	Masc
Lors du quart de finale contre les Pays-Bas , Il fait une passe décisive avant de marquer contre son camp puis d' être expulsé .	décisive	13	Fem
Les frontières entre chaque profession étaient imprécises et mouvantes .	imprécises	6	Fem
Ce réveil spirituel allie enseignement et œuvres missionnaires .	missionnaires	7	Fem
Il devrait comparaître dans les prochains jours pour indiquer s' il plaide coupable ou non coupable des faits qui lui sont reprochés .	prochains	5	Masc
S' agissant des Juifs , il accepta d' insérer une question déclarative supplémentaire ( 11 ) : « Êtes -vous de race juive ?	juive	22	Fem
La ville , qui longe la mer sur trente-neuf kilomètres de côtes , est la plus méridionale de Provence et son relief côtier alterne entre rivages de sable ou falaises rocheuses .	rocheuses	30	Fem
La rapport qualité / prix est imbattable avec un premier menu à 26 € !	imbattable	6	Masc
La typologie des tombes est variée :	variée	5	Fem
La loratadine est un antihistaminique H1 de deuxième génération ( dépourvue d' effet sédatif et anticholinergique ) .	anticholinergique	15	Masc
Située dans une région aux précipitations abondantes et régulières , la rivière est navigable et fait partie du réseau bolivien des voies navigables d' Amazonie .	bolivien	19	Masc
Les otites moyennes ( otitis media ) sont des inflammations de la muqueuse respiratoire qui tapisse la cavité tympanique .	moyennes	2	Fem
Ce mouvement est une organisation laïque de lutte contre l' exclusion , présente aujourd'hui dans 36 pays du Monde .	laïque	5	Fem
Papilionanthe est un genre de la famille des Orchidaceae , sous-famille des Epidendroideae comptant une douzaine d' espèces d' orchidées épiphytes d' Asie du Sud-Est .	épiphytes	20	Fem
Sur le plan instrumental , le groupe est caractérisé par les entrelacs et contrepoints du bouzouki de Dónal Lunny et de la mandoline d' Andy Irvine , en accompagnement des merveiles d' O'Flynn aux uilleann pipes .	instrumental	3	Masc
Plus loin au nord , sur l' entrée « Beaulieu » de l' actuelle rocade , soit l' extrémité nord du quartier Madeleine , était situé un champ de manœuvre spécialement entretenu pour les militaires de la ville .	actuelle	13	Fem
Les autorités du Sahara ont lancé un appel pressant à l' Union européenne pour exclure les eaux territoriales de leur pays de tout accord avec le Maroc conformément aux dispositions des conventions et normes internationales .	territoriales	17	Fem
Il assure de ce fait l' approvisionnement du pays en grain et en céréales , acquérant un peu plus tard la ferme fiscal sur les fourrages .	fiscal	22	Masc
D' un autre côté , les crises économique , financière , énergétique , alimentaire et environnementale ont eu un impact désastreux sur les pays en voie de développement en général et Cuba en particulier .	énergétique	11	Fem
La commune de Tintigny se situe en Gaume et comprend les villages de Tintigny , Rossignol , Bellefontaine , Saint-Vincent , Breuvanne , Lahage , Ansart , Poncelle et Han , sur une superficie totale de hectares .	totale	34	Fem
Massimiliano Guareschi et Maurizio Guerri analysent ainsi les réflexions de Jünger : « le fait qu' [ il ] parle d' " armée du travail absolu " n' est pas un hasard .	absolu	25	Masc
Le Naufragé s' est réveillé confus , il ne comprenait rien de cet étrange rêve et il a voulu voir si dans les journaux ils parlaient de son cauchemar .	étrange	13	Masc
La Russie célèbre le 50ème anniversaire du vol de Gagarine , premier homme dans l' espace .	50ème	4	Masc
Le 7 janvier 2011 , il s' engage avec El Gawafel sportives de Gafsa .	sportives	11	Fem
En face du Collège royal de Curepipe est visible un monument aux morts érigé à la mémoire des soldats mauriciens tombés pendant la Première Guerre mondiale .	visible	8	Masc
L' acide zolédronique appartient à la classe des bisphosphonates azotés ;	azotés	9	Masc
Fréquent ( 1/100 à < 1/10 )	Fréquent	0	Masc
Quand ils reviennent dans leur communauté , ils tentent d' enseigner leur savoir aux jeunes nains curieux .	curieux	16	Masc
Les 8e Championnats d' Europe juniors d' athlétisme ont eu lieu en 1985 à Cottbus , en Allemagne .	8e	1	Masc
Avant l' introduction du singe rhésus , l' île était la plus grande colonie de nichage pour le fou brun .	brun	19	Masc
Ce protocole est expérimental , son efficacité n' a pas été démontrée scientifiquement , et il n' a pas été validé par la communauté médicale .	expérimental	3	Masc
Par conséquent , la productivité est variable et l' impact à long terme de son utilisation à grande échelle sur la qualité des sols et l' environnement est inconnu .	variable	6	Fem
Né dans une famille de tradition bouddhiste , il se convertit à l' islam à l' âge de 18 ans en 1968 .	bouddhiste	6	Fem
La pléthysmographie pénienne par extensomètre permet de vérifier si la dysfonction érectile a une origine psychologique ou physiologique .	physiologique	17	Fem
De nombreux restaurant servent le chile con queso avec du pico de gallo , des haricots noirs , du guacamole ou du porc ou du bœuf haché .	noirs	16	Masc
Le Président décide de traiter l' affaire par le mépris et fait confiance aux autres journaux pour mener une enquête scrupuleuse qui rétablirait la vérité .	scrupuleuse	20	Fem
Le commerce des otages est devenu un commerce juteux pour les terroristes dans la sous-région du Sahel .	juteux	8	Masc
Ces abeilles métisses sont plus agressives que les abeilles des races dont elles sont issues .	agressives	5	Fem
La première sorte sont de rares variants qui entraînent de sévères et prédominants effets sur de simples traits ( exemple la mucoviscidose , la maladie de Huntington ) .	simples	16	Masc
Le Brillant à couronne verte ( Heliodoxa xanthogonys ) est une espèce de colibri de la sous-famille des Trochilinae .	verte	4	Fem
Il publie ensuite , sur le site france-israel.org , le texte de cette chronique radiophonique .	radiophonique	14	Fem
En approchant des côtes bretonnes , les 46 solitaires de La Solitaire du Figaro doivent faire face au courant de marée montante , flot contraire qui peut atteindre plus de six nœuds en certains passages .	montante	21	Fem
Un justicier catholique , plus mercenaire qu' angélique , enquête à ses risques et périls sur des phénomènes mystiques .	mystiques	18	Masc
Les rameaux , robustes , lisses à légèrement pubescents , sont rougeâtres ou marron .	robustes	3	Masc
Le village de Garrebourg acquiert alors un statut très particulier : il est considéré comme indivis entre ses co-propriétaires dont certains sont lorrains et d' autres alsaciens ...	lorrains	22	Masc
Puis B disparaît soudain de son journal intime .	intime	7	Masc
La communauté de communes Aubusson-Felletin est une structure intercommunale française , située dans le département de la Creuse et la région Limousin .	intercommunale	8	Fem
Lors de la mise en place du Royaume , l' Islande était sous le contrôle de la couronne danoise depuis 1380 , bien qu' elle ait été formellement une possession norvégienne jusqu' en 1814 .	norvégienne	30	Fem
Dans les points de collecte , les modules sont triés selon leur technologie ( cristalline ou couches minces ) puis transportés vers un centre de recyclage de PV CYCLE où ils sont triés .	minces	17	Fem
Douleur dorsale , douleur thoracique , douleur à l' aine	dorsale	1	Fem
Les intérêts légitimes du peuple basque sont représentés par des personnes élues démocratiquement .	élues	11	Fem
Ils nous ont replacé notre site internet sur la première page en peu de temps et sur un secteur d' activité très concurrentiel !	concurrentiel	22	Masc
Les Laboulbeniomycetes sont une classe de champignons atypiques , quasi microscopiques , appartenant au grand groupe des ascomycètes .	microscopiques	10	Masc
L' objectif pastoral de ces rencontres lui semble être d' attirer quelques jeunes initialement plus tièdes dans le cercle des enthousiastes .	tièdes	15	Masc
Pedro Delgado , leader du Tour à 5 jours de l' arrivée est contrôlé positif au probénécide , produit masquant l' usage de stéroïdes anabolisants .	anabolisants	24	Masc
Poisson de fond ou poisson benthique sont des appellations usuelles attribuées à des poissons qui vivent de préférence loin de la surface de l' eau .	benthique	5	Masc
Flora Brovina , la docteur albanaise condamnée le 13 janvier à Nis , est maintenant gravement malade et mise sous surveillance dans une clinique de la même ville .	albanaise	5	Fem
Ses livres étaient souvent ornés d' un frontispice gouaché et de bordures dorées ;	dorées	12	Fem
Contournant l' interdiction de diffusion et le brouillage , Aljazeera a continué à couvrir « la révolution égyptienne » jusqu' à la chute du président Moubarak , le 11 février dernier .	égyptienne	17	Fem
Bifidobactérium ( anciennement Lactobacillus bifidus ) est un bacille à gram positif , immobile , avec une morphologie ramifiée .	positif	11	Masc
Les civilisations de ces peuples étaient initialement moins urbaines , juridiques et scripturaires que celle des Grecs et des Romains , mais non moins complexes religieusement , socialement et artistiquement .	complexes	24	Fem
L' ensemble présente un aspect fortifié ( fossés et petites ouvertures ) du côté nord , qui vient en opposition avec une façade méridionale où le décor de la fin des XVe et XVIe siècles s' impose .	fortifié	5	Masc
Grâce à sa victoire 80-63 face à la Corée lors du tournoi de qualification olympique en quart de finale , l' équipe de France de basket-ball féminine s' est qualifiée pour les Jeux olympiques .	féminine	26	Fem
La méthodologie du travail universitaire et les techniques d' apprentissage représentent un volume horaire de l' ordre de 10 % de la formation encadrée .	universitaire	4	Masc
Hank était juste trop saoul pour s' en souvenir .	saoul	4	Masc
Ce NON n' est pas forcément explicite .	explicite	6	Masc
" Si cela continue , je vais ouvrir une salle municipale " confiait le premier magistrat .	municipale	10	Fem
Sur Facebook , hier soir , le spécialiste en marketing François Descarie a écrit que « pour une fois , le match a été plus intéressant que les pubs » .	intéressant	25	Masc
Ce vol de 12 jours a permis de ramener une moisson scientifique , et de découvrir l' existence d' une ceinture de particules cosmiques autour de l' équateur géomagnétique vers 400 km d' altitude .	cosmiques	23	Fem
Les marchés financiers européens souffrent actuellement d' un cloisonnement national , même si , suite à la globalisation du système financier international , l' on assiste à un phénomène généralisé de concentration et d' internationalisation .	généralisé	29	Masc
Il y a lieu de consulter et de faire collaborer activement les parties intéressées à cette analyse .	intéressées	13	Fem
L' efficacité des programmes mis en oeuvre avec le soutien de l' Union Européenne a trop souvent dû souffrir d' une prise de décision trop lente et d' une gestion trop complexe .	lente	25	Fem
Bilan contrasté , donc , au moment où le gouvernement prépare des réformes électorales défavorables à la parité .	électorales	13	Fem
J' ai assisté à un fabuleux spectacle de cabaret dans une ambiance chaleureuse et conviviale	chaleureuse	12	Fem
Le ministre délégué aux Affaires maghrébines et africaines , Abdelkader Messahel , animera ensuite une conférence de presse en présence de plus de 80 journalistes étrangers invités à cette rencontre .	africaines	7	Fem
En mars 1955 , Phoumi fut un des membres fondateurs du Parti du Peuple laotien , au bureau politique duquel il fut élu .	laotien	14	Masc
Zwingli répondit aux objections qu' il revenait à l' usage de l' Église primitive , qu' on avait observé jusqu' à Charlemagne ;	primitive	13	Fem
Il traite des questions économiques israéliennes et internationales , c' est le plus ancien et le plus influant des journaux financiers en Israël , il est aussi le plus diffusé .	israéliennes	5	Fem
Son pendant administratif ( suivi consenti et / ou demandé par les responsables légaux ) est nommé AED ou Assistance Educative à Domicile .	légaux	13	Masc
Si l' acceptant crée une oeuvre dite dérivée , à la demande de tout offrant , il devra , dans la mesure du possible , retirer de l' oeuvre dite dérivée toute référence au dit offrant , comme demandé .	dérivée	30	Fem
Mais l' Union européenne compte aussi sur les pays du Proche et Moyen-Orient pour augmenter les volumes de gaz dans le pipeline , avec la potentielle participation de l' Irak et de l' Égypte .	potentielle	25	Fem
En tout , sept empreintes digitales non identifiées sont retrouvées sur les lieux .	identifiées	7	Fem
L' énumération des biens constituant le domaine de la seigneurie de Cheffontaines occupe 80 pages d' un aveu conservé aux Archives Départementales du Finistère .	Départementales	21	Fem
Padmasambhava aurait confié son enseignement oral à Yeshe Tsogyal , princesse de Kharchen , sa compagne tibétaine , qui le transcrivit en écriture de dākinī et le dissimula pour les siècles à venir .	tibétaine	16	Fem
Un robot gigantesque possédant 3 pieds et 3 corps reliés par une pièce centrale .	gigantesque	2	Masc
Ils ont été les premiers animaux à exploiter le matériel végétal dans la chaîne alimentaire terrestre , faisant ainsi de leur apparition une étape importante tant dans l' évolution des vertébrés que dans les écosystèmes terrestres .	végétal	10	Masc
La solution des problèmes sociaux , qui restait encore cachée dans les rapports économiques embryonnaires , devait jaillir du cerveau .	embryonnaires	14	Masc
Orienté sur un axe nord-sud , ce bâtiment mesure soixante mètre de longueur pour une trentaine de largeur pour sa partie nord et une quarantaine pour sa partie sud .	nord-sud	4	Masc
La chanson s' ouvre sur une descente harmonique , partant du Ré pour aboutir sur le Sol .	harmonique	7	Fem
Il y passe les 20 années suivantes en pratiques spirituelles -- incluant de longues heures de méditation , la pratique de l' athlétisme , l' écriture de poésies , essais et chants spirituels .	spirituelles	9	Fem
Les tomates sont commercialisées sous la marque « Idyl » sur le marché Européen .	Européen	13	Masc
Ce n' est pas du tout un bar , mais bel et bien un restaurant haut de gamme .	haut	15	Masc
Le fond est ainsi déterminé par des points discrets , en prenant en compte l' origine physique du fond et les pics d' absorption .	discrets	8	Masc
Mais je laisse ça sur le compte d' un groupe de gamines qui pensaient être les seules clientes au monde ( quand elles sont parties , tous les autres clients étaient soulagés , c' est pour dire ) .	seules	16	Fem
Le cours de l' Arve et les sections inondables sont classés comme zone naturelle d' intérêt écologique , faunistique et floristique de type II et compte plusieurs sites naturels remarquables comme les granges de Passy .	remarquables	29	Masc
Distribuée le 4 octobre 2004 , sous le label Warp Records , la bande originale a été composée par Aphex Twin .	originale	14	Fem
Second fils du major-général Vassili Vassilievitch Kotchoubeï ( 1756-1800 ) et de son épouse Ielena Vassilievna Toumanskaïa ( 1762-1836 ) .	Second	0	Masc
Sa carrière démarre en 1811 lorsqu' il décide d' envoyer un de ces tableaux , Sadak in Search of the Waters of Oblivion à la Royal Academy .	Royal	25	Masc
Il part en zone occupée où il est affecté à la Société industrielle pour l' aéronautique ( SIPA ) .	occupée	4	Fem
Il s' agit sur le plan structurel d' un organe de gestion administrative , économique et financier indépendant placé sous la tutelle de trois ministères cumulés ;	structurel	6	Masc
Le Français Kevin Mayer remporte l' octathlon avec la meilleure marque mondiale .	meilleure	9	Fem
Cette initiative -là était contre-productive .	contre-productive	4	Fem
Le travail des forces non conservatives , si celui-ci n' est pas nul , implique une variation de l' énergie mécanique totale du système ( sa non conservation ) .	conservatives	5	Fem
Insatisfaits de leur vie , ils se prennent pour les héros des feuilletons télévisés américains , c' est ainsi que JR , Sue Ellen , Rambo , Kojak , ... prennent possession des corps et esprits .	Insatisfaits	0	Masc
Dans les céramiques composites , ce genre de fentes est traversé par les fibres .	composites	3	Fem
Bien qu' elle soit épaisse , la queue est flexible et musclée .	flexible	9	Fem
Elle se dote notamment de grands classiques du cinéma français et américain ainsi que d' un fonds important de cinéma soviétique .	soviétique	20	Masc
Ce mot polysémique peut donc désigner l' art , sa technique ou encore , par métonymie , la salle dans laquelle il est projeté .	polysémique	2	Masc
Le fond est ainsi déterminé par des points discrets , en prenant en compte l' origine physique du fond et les pics d' absorption .	physique	16	Fem
La femelle couve de 5 à 6 œufs , ovales et légèrement piriformes , gris verdâtre et tachés de brun-rouge , dont la taille a pour valeurs extrêmes : 16,4 -- × 12,5 -- .	ovales	9	Masc
Sur une des rares occasions des Trinitéens , l' attaquant Cornell Glen frappe la barre transversale des Suédois .	transversale	15	Fem
Le début de l' histoire du domaine à Little Hunting Creek est distinct de l' histoire de la maison , qui ne débute pas avant 1741-42 et qui ne fut occupée la première fois qu' en 1743 .	distinct	12	Masc
Ce portail s' articule autour de la porte centrale , la Puerta del Perdón , surmontée d' un gâble et d' une galerie d' arcatures gothiques aveugles .	gothiques	25	Fem
les plats sont excellents et copieux .	excellents	3	Masc
Loin d' être exotiques , ils sont abondamment présents lorsque l' on fait des clichés de champs profond de l' univers observable .	observable	21	Masc
Les Fermiers généraux , avec leurs fortunes colossales , apparaissent comme la marque même de la perversion du système politique et social .	colossales	7	Fem
Rockwell était notamment le fabricant des 7 navettes spatiales américaines ( Enterprise , Pathfinder , Columbia , Atlantis , Endeavour , Discovery et Challenger ) .	spatiales	8	Fem
Il sera prouvé par la suite que l' algorithme avait été amélioré du point de vue cryptographique en limitant les possibilités d' attaques différentielles .	cryptographique	16	Masc
Même si Pépin l' Ancien a eu des homonymes dans son ascendance proche , ces derniers n' ont laissé aucune trace dans la documentation contemporaine et rien ne justifierait cette qualification de « prince » .	contemporaine	24	Fem
Avant de devenir la star interplanétaire qu' elle est aujourd'hui , Lady Gaga a filé le parfait amour avec Luc Carl pendant quatre ans .	interplanétaire	5	Fem
Arbuste , parfois densément ramifié , avec des rameaux d' abord laineux puis glabres .	glabres	13	Masc
En moyenne annuelle , la température s' établit à 10,8 ° C , avec une maximale de 15,2 ° C et une minimale à 6,4 ° C .	minimale	22	Fem
Certaines erreurs judiciaires résultent d' une entente de la police et de la justice dans un but médiatique ( ex : affaire d' Outreau ) .	judiciaires	2	Fem
Pour rejoindre les marchés du sud-ouest asiatique , Vasco de Gama passe en 1498 par le cap de Bonne-Espérance .	asiatique	6	Masc
lorsque l' Oeuvre est une base de données , extraire et réutiliser des parties substantielles de l' oeuvre .	substantielles	14	Fem
Il s' agit d' une adaptation du conte de La Petite Fille aux allumettes du poète danois Hans Christian Andersen .	Petite	10	Fem
Avec deux anneaux et deux balais , il est possible de transférer l' électricité produite par les bobinages du rotor hors de la machine tournante ou , à l' inverse , d' alimenter le ou les bobinages du rotor .	tournante	24	Fem
Depuis 2004 , le théâtre dispose de deux salles modernes avec La Coupole ( 437 places ) et La Galerie ( 230 places modulables ) .	modulables	23	Fem
Ses applications sont rattachées aux sciences informatiques et à leurs spécialités ( telles que l' intelligence artificielle ou la classification ) .	artificielle	16	Fem
Durant son périple , Joey ne laisse personne indifférent , car , de par sa présence et son comportement , il donne espoir aux soldats qui l' entourent .	indifférent	8	Masc
C' est un climat tempéré à légère tendance continentale avec des étés chauds et des hivers froids , avec une amplitude thermique assez importante entre ces deux saisons .	froids	16	Masc
Tous les services judiciaires qui étaient éparpillés ont donc pu être regroupés .	judiciaires	3	Masc
L' AS Anvers-Borgerhout est un des plus anciens clubs anversois , fondé dès la fin du XIXe siècle .	anciens	7	Masc
Sylviane Friederich , née à Morges le 13 juillet 1950 , est une galeriste , libraire et éditeur vaudoise .	vaudoise	18	Fem
Drangey est une île islandaise aux falaises abruptes .	islandaise	4	Fem
En vigueur depuis 2008 , cet accord expirera dans quelques semaines et sera donc renégocié par les deux parties concernées , le Maroc et l' Union Européenne via sa Commission .	Européenne	26	Fem
Le niveau de bruit optimal est supérieur au niveau de bruit de fond minimal théorique ( phénomène de résonance stochastique ) .	optimal	4	Masc
Selon Nicéphore Grégoras , la flotte byzantine compte plus de 50 navires tandis que l' Italien Marino Sanuto l' Ancien mentionne 80 navires impériaux .	byzantine	6	Fem
En 1563 , les disputes entre le Danemark et la Suède entraînent le déclenchement de la guerre nordique de Sept Ans , qui se termine en 1570 avec le traité de Stettin .	nordique	17	Fem
Les résultats des qualifications sont donc les résultats finaux de cette épreuve .	finaux	8	Masc
Les travaux de la table ronde ivoirienne suivent le calendrier prévu et pourraient se terminer avant la date butoir du 24 janvier , a indiqué le porte-parole du Quai d' Orsay .	ronde	5	Fem
Il fait ses débuts professionnels en 2007 au sein de l' équipe espagnole Euskaltel-Euskadi .	professionnels	4	Masc
En mai et juin 2004 , le juge Renaud Van Ruymbeke a reçu deux lettres anonymes et un CD-ROM contenant des listings de comptes de la chambre de compensation luxembourgeoise Clearstream .	luxembourgeoise	29	Fem
Il est tourmenté par des rêves étranges et prophétiques qu' il partage avec un prêcheur méthodiste , Justin Crowe , vivant en Californie .	méthodiste	15	Masc
Un félin sur le terrain et un shoot en suspension hors-catégorie , avec sa détente sèche à 90 cm !	sèche	15	Fem
L' intégrale de la fonction nulle est nulle sur tout intervalle inclus dans l' ensemble des réels ;	nulle	5	Fem
Cet exode massif a changé la vie à El Aaiun où , à titre d' exemple , certains collèges ont fermé pour manque d' élèves .	massif	2	Masc
Le 27 mai 2011 , le Président chargé de l' instruction au Tribunal de grande instance de Paris rend une ordonnance de non-lieu pour charges insuffisantes à l' encontre d' Yves Poey .	insuffisantes	25	Fem
Les sushis livrés sont avariés .	avariés	4	Masc
Développé à partir de 1994 , mSQL comblait le trou qui existait entre les bases de données personnelles intégrées comme Microsoft Access et celles commerciales comme Oracle ou DB2 .	intégrées	18	Fem
La clairance corporelle totale est de 5,04 ± 2,5 l / h , elle est indépendante de la dose et n' est pas influencée par le sexe , l' âge , l' ethnie ou le poids corporel .	corporelle	2	Fem
Ingram Marshall est un compositeur américain de musique contemporaine , se situant plus précisément dans le courant de la musique minimaliste .	contemporaine	8	Fem
Le Rat à grosse tête ( Clyomys bishopi ) est une espèce de rongeurs de la famille des Echimyidae qui regroupe des petits mammifères d' Amérique du Sud appelés aussi rats épineux .	épineux	31	Masc
Maîtrise divine sur le chaos ?	divine	1	Fem
Denécé est régulièrement consulté par les médias français et internationaux et compte à son actif plus d' un millier d' interventions radiophoniques et plusieurs centaines d' interventions télévisées .	actif	14	Masc
Le résultat a été positif : de 1954 à 1959 , Benfica a remporté deux championnats et trois coupes .	positif	4	Masc
Le 3 juillet 1979 , Carter signa un finding ( ordre exécutif ) autorisant pour la première fois un soutien à la guérilla anticommuniste moudjahidine .	moudjahidine	24	Fem
